title,date_published,genre,duration,director,writer,actors,avg_vote,votes,budget,worlwide_gross_income,reviews_from_users,reviews_from_critics,profit,roi,release_month,release_year
La punta della lancia,2006-01-20,"Adventure, Biography, Drama",108,Jim Hanon,"Bill Ewing, Bart Gavigan","Louie Leonardo, Chad Allen, Jack Guzman, Christina Souza, Chase Ellison, Chemo Mepaquito, Ninabet Bedoya, Sara Kathryn Bakker, Cara Stoner, Beth Bailey, Ocniel Barrigon, Yariela Caizamo, Andrea Lino Mache, Marco Flaco, Gabriela Valdespino",6.8,4850,10.0,12.128105,154.0,49.0,2.128105,21.28105,1,2006
Non è peccato,2006-09-01,Drama,90,"Richard Glatzer, Wash Westmoreland","Richard Glatzer, Wash Westmoreland","Jesus Castanos, Araceli Guzman-Rico, Emily Rios, J.R. Cruz, Listette Avila, Alicia Sixtos, Hector Quevedo, Germán Campos, Carlos Linares, Johnny Chavez, Carmen Aguirre, Margarita Lugo, Jorge Ortiz, Veronica Sixtos, Jesse Garcia",6.9,3991,0.4,2.522787,48.0,68.0,2.122787,530.69675,9,2006
The Boynton Beach Bereavement Club,2006-08-25,"Comedy, Romance",105,Susan Seidelman,"Florence Seidelman, David Cramer","Brenda Vaccaro, Dyan Cannon, Len Cariou, Joseph Bologna, Sally Kellerman, Michael Nouri, Renée Taylor, Mal Z. Lawrence, Ashley Blackwell, Kim Ostrenko, Janice Hamilton, Irene B. Colletti, Barbara Pergament, Loli Rainey, George Schiavone",6.4,934,1.5,3.572758,29.0,34.0,2.072758,138.18386666666666,8,2006
Lezioni d'amore,2009-04-30,"Drama, Romance",112,Isabel Coixet,"Nicholas Meyer, Philip Roth","Penélope Cruz, Ben Kingsley, Dennis Hopper, Patricia Clarkson, Peter Sarsgaard, Debbie Harry, Charlie Rose, Antonio Cupo, Michelle Harrison, Sonja Bennett, Emily Holmes, Chelah Horsdal, Marci T. House, Alessandro Juliani, Tiffany Lyndall-Knight",6.7,21695,13.0,14.894347,117.0,139.0,1.894347,14.5719,4,2009
City Island,2010-05-25,"Comedy, Drama",104,Raymond De Felitta,Raymond De Felitta,"Andy Garcia, Julianna Margulies, Steven Strait, Emily Mortimer, Ezra Miller, Dominik Garcia, Carrie Baker Reynolds, Hope Glendon-Ross, Alan Arkin, Louis Mustillo, Jee Young Han, Sarah Saltzberg, Curtiss Cook, Sharon Angela, Marianne Ebert",7.4,30318,6.0,7.878856,109.0,147.0,1.878856,31.31426666666667,5,2010
Parto con mamma,2012-12-19,"Comedy, Drama",95,Anne Fletcher,Dan Fogelman,"Barbra Streisand, Seth Rogen, Julene Renee, Zabryna Guevara, John Funk, Robert Curtis Brown, Kathy Najimy, Miriam Margolyes, Rose Abdoo, Tom Virtue, Vivian Vanderwerd, Worth Howe, Vicki Goldsmith, Matthew Levinson, Joseph Levinson",5.7,35011,40.0,41.863726,113.0,151.0,1.863726,4.659315,12,2012
Storia di un fantasma,2017-07-27,"Drama, Fantasy, Romance",92,David Lowery,David Lowery,"Casey Affleck, Rooney Mara, McColm Cephas Jr., Kenneisha Thompson, Grover Coulson, Liz Cardenas, Barlow Jacobs, Richard Krause, Dagger Salazar, Sonia Acevedo, Carlos Bermudez, Yasmina Gutierrez, Kimberly Fiddes, Daniel Escudero, Kesha",6.9,58011,0.1,1.951683,605.0,320.0,1.851683,1851.683,7,2017
Another Earth,2012-05-18,"Drama, Romance, Sci-Fi",92,Mike Cahill,"Mike Cahill, Brit Marling","Brit Marling, Matthew-Lee Erlbach, DJ Flava, William Mapother, Meggan Lennon, AJ Diana, Bruce Colbert, Paul Mezey, Ana Valle, Jeffrey Goldenberg, Joseph A. Bove, Jordan Baker, Flint Beverage, Robin Lord Taylor, Rupert Reid",7.0,89685,0.1,1.938783,290.0,253.0,1.838783,1838.7830000000001,5,2012
Shut Up and Sing,2009-11-13,"Comedy, Drama, Music",96,Bruce Leddy,Bruce Leddy,"David Harbour, Reg Rogers, Alexander Chaplin, Chris Bowers, David Alan Basche, Mark Feuerstein, Samrat Chakrabarti, Rosemarie DeWitt, Molly Shannon, Elizabeth Reaser, Liz Stauber, Camilla Thorsson, Joanna Adler, Barry Carl, Nolan Chesnut",5.6,618,1.0,2.811468,25.0,21.0,1.811468,181.1468,11,2009
"CHIPS, (dis)ordine pubblico",2017-07-20,"Action, Comedy, Crime",100,Dax Shepard,"Rick Rosner, Dax Shepard","Michael Peña, Dax Shepard, Vincent D'Onofrio, Rosa Salazar, Jessica McNamee, Adam Brody, Isiah Whitlock Jr., Richard T. Jones, Ryan Hansen, Jane Kaczmarek, Phil Tyler, Jess Rowland, Carly Hatter, Justin Chatwin, Vida Guerra",6.0,41606,25.0,26.800152,198.0,122.0,1.800152,7.200608,7,2017
Whipped - Ragazzi al guinzaglio,2001-06-22,"Comedy, Romance",82,Peter M. Cohen,Peter M. Cohen,"Amanda Peet, Brian Van Holt, Jonathan Abrahams, Zorie Barber, Judah Domke, Callie Thorne, Montse Viader, Linda Udd, Doug MacHugh, Gordon Feinberg, Suzanne Molloy, David Heyman, Bo Bazylevski, David J. Cohen, Phil Nourie",4.6,3888,3.0,4.775009,83.0,47.0,1.775009,59.16696666666667,6,2001
Whip It,2009-10-02,"Drama, Sport",111,Drew Barrymore,"Shauna Cross, Shauna Cross","Sarah Habel, Shannon Eagen, Edward Austin Kelly, Mary Callaghan Lynch, Ellen Page, Jimmy Fallon, Alia Shawkat, Marcia Gay Harden, Barbara Coven, Eulala Scheel, Nina Kircher, Daniel Stern, Mark Boyd, Carlo Alban, Douglas Minckiewicz",6.9,63203,15.0,16.691303,130.0,197.0,1.691303,11.275353333333333,10,2009
Cercasi amore per la fine del mondo,2013-01-17,"Adventure, Comedy, Drama",101,Lorene Scafaria,Lorene Scafaria,"Steve Carell, Keira Knightley, Adam Brody, Connie Britton, Roger Aaron Brown, Rob Huebel, Trisha Gorman, Nancy Carell, Mark Moses, Tonita Castro, Leslie Murphy, Rob Corddry, Kasey Campbell, Melanie Lynskey, Vince Grant",6.7,106300,10.0,11.681781,267.0,278.0,1.681781,16.81781,1,2013
Cosa mi lasci di te,2020-03-19,"Biography, Drama, Music",116,"Andrew Erwin, Jon Erwin","Jeremy Camp, Jon Erwin","K.J. Apa, Britt Robertson, Nathan Parsons, Gary Sinise, Shania Twain, Reuben Dodd, Nicolas Bechtel, Melissa Roxburgh, Terry Serpico, Tanya Christiansen, Cameron Arnett, Abigail Cowen, Rushi Birudala, Anjelah Johnson-Reyes, Mike McGill",6.5,6196,12.0,13.681524,151.0,52.0,1.681524,14.0127,3,2020
Home Run,2014-02-26,"Drama, Sport",113,David Boyd,"Brian Brightly, Candace Lee","Scott Elrod, Dorian Brown Pham, Charles Henry Wyson, James Devoti, Nicole Leigh, Juan Martinez, Drew Waters, Robert Peters, Vivica A. Fox, Johnny Baker, Billy Brazelton, Bob Carpenter, Victor Cruz, J. Alan Davidson, Gabe Davis",5.9,2824,1.2,2.86102,34.0,12.0,1.66102,138.41833333333332,2,2014
Youth in Revolt,2010-01-08,"Comedy, Drama, Romance",90,Miguel Arteta,"Gustin Nash, C.D. Payne","Michael Cera, Portia Doubleday, Jean Smart, Zach Galifianakis, Erik Knudsen, Adhir Kalyan, Steve Buscemi, Fred Willard, Ari Graynor, Ray Liotta, Justin Long, Rooney Mara, Jade Fusco, Lise Lacasse, M. Emmet Walsh",6.4,71895,18.0,19.651093,110.0,195.0,1.651093,9.172738888888889,1,2010
Trick,2000-05-05,"Comedy, Music, Romance",89,Jim Fall,Jason Schafer,"Tori Spelling, Christian Campbell, John Paul Pitoc, Brad Beyer, Lacey Kohl, Abbey Hope, Becky Caldwell, Kate Flannery, Steve Hayes, Will Keenan, Joey Dedio, Ricky Ritzel, Lissette Gutierrez, Lorri Bagley, Kevin Andrew",7.1,8095,0.45,2.087228,131.0,17.0,1.637228,363.8284444444445,5,2000
Demonic,2017-10-10,"Horror, Mystery, Thriller",83,Will Canon,"Max La Bella, Will Canon","Maria Bello, Frank Grillo, Cody Horn, Dustin Milligan, Scott Mechlowicz, Megan Park, Aaron Yoo, Alex Goode, Terence Rosemore, Jesse Steccato, Meyer DeLeeuw, Griff Furst, Thomas Francis Murphy, Ashton Leigh, Katarina Boudreaux",5.3,13226,3.0,4.476578,78.0,77.0,1.476578,49.21926666666667,10,2017
Serenity,2005-11-25,"Action, Adventure, Sci-Fi",119,Joss Whedon,Joss Whedon,"Nathan Fillion, Gina Torres, Alan Tudyk, Morena Baccarin, Adam Baldwin, Jewel Staite, Sean Maher, Summer Glau, Ron Glass, Chiwetel Ejiofor, David Krumholtz, Michael Hitchcock, Sarah Paulson, Yan Feldman, Rafael Feldman",7.8,279887,39.0,40.445129,1671.0,203.0,1.445129,3.7054589743589745,11,2005
Full Frontal,2002-09-20,"Comedy, Romance",101,Steven Soderbergh,Coleman Hough,"David Duchovny, Nicky Katt, Catherine Keener, Mary McCormack, David Hyde Pierce, Julia Roberts, Blair Underwood, Enrico Colantoni, Erika Alexander, Tracy Vilar, Brandon Keener, Jeff Garlin, David Alan Basche, Terence Stamp, Nancy Lenehan",4.7,9402,2.0,3.438804,168.0,108.0,1.438804,71.9402,9,2002
Gonne al bivio,2000-08-11,"Comedy, Drama, Romance",85,Jamie Babbit,"Brian Peterson, Jamie Babbit","Natasha Lyonne, Michelle Williams, Brandt Wille, Bud Cort, Mink Stole, RuPaul, Katie Donahue, Danielle Rene, Cathy Moriarty, Eddie Cibrian, Melanie Lynskey, Clea DuVall, Katrina Phillips, Katharine Towne, Joel Michaely",6.6,25806,1.2,2.595216,198.0,80.0,1.395216,116.268,8,2000
Songcatcher,2001-07-27,"Drama, Music",109,Maggie Greenwald,Maggie Greenwald,"Janet McTeer, Michael Davis, Michael Goodwin, Gregory Russell Cook, Jane Adams, E. Katherine Kerr, Emmy Rossum, Pat Carroll, Stephanie Roth Haberle, Aidan Quinn, Bart Hansard, Erin Blake Clanton, David Patrick Kelly, Kristin Hall, Michael Harding",7.2,3210,1.8,3.171273,78.0,39.0,1.371273,76.18183333333334,7,2001
Ruby Sparks,2012-12-06,"Comedy, Drama, Fantasy",104,"Jonathan Dayton, Valerie Faris",Zoe Kazan,"Paul Dano, Zoe Kazan, Chris Messina, Annette Bening, Antonio Banderas, Aasif Mandvi, Steve Coogan, Toni Trucks, Deborah Ann Woll, Elliott Gould, Alia Shawkat, Jane Anne Thomas, John F. Beach, Eleanor Seigler, Emma Julia Jacobs",7.2,94423,8.0,9.368803,151.0,279.0,1.368803,17.1100375,12,2012
Old Fashioned,2015-02-13,"Drama, Romance",115,Rik Swartzwelder,Rik Swartzwelder,"Elizabeth Roberts, Rik Swartzwelder, LeJon Woods, Tyler Hollinger, Nini Hadjis, Maryanne Nagel, Lindsay Heath, Joseph Bonamico, Dorothy Silver, Ange'le Perez, Anne Marie Nestor, Frank Jones Jr., Todd McCune, William K. Baker, Stephen R. Campanella",5.2,1859,0.6,1.91409,124.0,44.0,1.31409,219.01500000000001,2,2015
Please Give,2010-06-18,"Comedy, Drama",87,Nicole Holofcener,Nicole Holofcener,"Rebecca Hall, Elizabeth Keener, Elise Ivy, Catherine Keener, Josh Pais, Sarah Steele, Ann Morgan Guilbert, Amanda Peet, Oliver Platt, Griffin Frazen, Reggie Austin, Scott Cohen, Paul Sparks, Lois Smith, Thomas Ian Nicholas",6.6,10928,3.0,4.313829,54.0,135.0,1.313829,43.7943,6,2010
Lowriders,2017-04-28,"Adventure, Crime, Drama",98,Ricardo de Montreuil,"Elgin James, Cheo Hodari Coker","Gabriel Chavarria, Demián Bichir, Theo Rossi, Tony Revolori, Melissa Benoist, Yvette Monreal, Eva Longoria, Montse Hernandez, Noel Gugliemi, Bryan Rubio, Cress Williams, Franck Khalfoun, Pepe Serna, Taishi Mizuno, David Fernandez Jr.",5.6,2175,5.0,6.312033,14.0,14.0,1.312033,26.24066,4,2017
Escanaba in da Moonlight,2001-02-09,"Comedy, Fantasy",91,Jeff Daniels,"Jeff Daniels, Jeff Daniels","Jeff Daniels, Harve Presnell, Joey Albright, Wayne David Parker, Randall Godwin, Kimberly Guerrero, James Porterfield, Guy Sanville, Lucas Daniels, Phillip W. Powers, Sandra Birch, Alex Mulvaney, Kyle Broeders, Belinda 'Allee' Eagle, Chad Decota",6.5,1711,1.0,2.276602,106.0,9.0,1.276602,127.6602,2,2001
In Search of a Midnight Kiss,2008-08-01,"Comedy, Romance",90,Alex Holdridge,Alex Holdridge,"Scoot McNairy, Sara Simmonds, Brian McGuire, Kathleen Luong, Robert Murphy, Twink Caplan, Bret Roberts, Ann Chatterton, Cindy Drummond, Giorgio Pierangeli, Michael Pierangeli, Bruce Jay, Stephanie Feury, Julie Levin-Pierangeli, Kennedy Rich-Collins",7.2,7871,0.025,1.294176,48.0,87.0,1.269176,5076.704,8,2008
Sleepwalk with Me,2013-04-04,Comedy,81,"Mike Birbiglia, Seth Barrish","Mike Birbiglia, Ira Glass","Mike Birbiglia, Lauren Ambrose, James Rebhorn, Carol Kane, Cristin Milioti, Aya Cash, Marylouise Burke, Loudon Wainwright III, Ben Levin, Henry Phillips, Jessi Klein, Emily Meade, Danny Borbon, Amanda Perez, Lucy DeVito",6.8,11448,1.0,2.266067,31.0,127.0,1.266067,126.6067,4,2013
5 appuntamenti per farla innamorare,2010-06-18,"Comedy, Romance",98,Nia Vardalos,"Nia Vardalos, Nia Vardalos","Nia Vardalos, John Corbett, Stephen Guarino, Amir Arison, Zoe Kazan, Gary Wilmes, Mike Starr, Jason Mantzoukas, Judah Friedlander, Rachel Dratch, Jay O. Sanders, Lynda Gravatt, Olive, Suzanne Shepherd, Dan Finnerty",4.7,8128,3.0,4.243957,51.0,34.0,1.243957,41.46523333333334,6,2010
Crossover,2006-09-01,"Action, Sport",95,Preston A. Whitmore II,Preston A. Whitmore II,"Anthony Mackie, Wesley Jonathan, Eva Marcille, Wayne Brady, Lil J.J., Philip Champion, Alecia Jai Fears, Kristen Wilson, William L. Johnson, Tamer Alwerfalli, Ele Bardha, Gavin J. Behrman, Michael Bivins, Shelli Boone, Linda Boston",2.1,8908,5.8,7.009668,34.0,26.0,1.209668,20.856344827586206,9,2006
ATL,2006-03-31,"Comedy, Crime, Drama",105,Chris Robinson,"Tina Gordon, Antwone Fisher","Greg Andrews, Monica, Brandon Bernard Benton, Adam Boyer, April Clark, Albert Daniels, Steven R. Ewing, Alvin Lee Fleming, Big Gipp, Bart Hansard, T.I., Khadijah Haqq, Malika Haqq, Bone Crusher, Monique Harris",6.1,10578,20.0,21.170563,98.0,51.0,1.170563,5.852815,3,2006
All the Boys Love Mandy Lane,2013-09-06,Horror,90,Jonathan Levine,Jacob Forman,"Amber Heard, Anson Mount, Michael Welch, Whitney Able, Edwin Hodge, Aaron Himelstein, Luke Grimes, Melissa Price, Adam Powell, Peyton Hayslip, Brooke Bloom, Robert Earl Keen",5.5,30988,0.75,1.90464,158.0,243.0,1.15464,153.952,9,2013
L.I.E.,2002-11-29,"Crime, Drama",97,Michael Cuesta,"Stephen M. Ryder, Michael Cuesta","Paul Dano, Bruce Altman, Billy Kay, James Costa, Tony Michael Donnelly, Michelle Carano, Tatiana Burgos, Brian Cox, B. Constance Barry, Walter Masterson, Brad Silnutzer, Bob Gerardi, Adam LeFevre, Frank Rivers, Anthony F. Peragine",7.1,9454,0.7,1.846059,110.0,70.0,1.146059,163.7227142857143,11,2002
Manuale scout per l'apocalisse zombie,2015-10-30,"Action, Comedy, Horror",93,Christopher Landon,"Carrie Lee Wilson, Emi Mochizuki","Tye Sheridan, Logan Miller, Joey Morgan, Sarah Dumont, David Koechner, Halston Sage, Cloris Leachman, Niki Koss, Hiram A. Murray, Lukas Gage, Drew Droege, Patrick Schwarzenegger, Blake Anderson, Elle Evans, Matty Cardarople",6.3,44058,15.0,16.137046,151.0,164.0,1.137046,7.580306666666667,10,2015
Quel fantastico peggior anno della mia vita,2015-12-10,"Comedy, Drama",105,Alfonso Gomez-Rejon,"Jesse Andrews, Jesse Andrews","Thomas Mann, RJ Cyler, Olivia Cooke, Nick Offerman, Connie Britton, Molly Shannon, Jon Bernthal, Matt Bennett, Katherine Hughes, Masam Holden, Bobb'e J. Thompson, Gavin Dietz, Edward DeBruce III, Natalie Marchelletta, Chelsea Zhang",7.7,120658,8.0,9.074749,225.0,316.0,1.074749,13.434362499999999,12,2015
Ultraviolet,2006-06-16,"Action, Sci-Fi",88,Kurt Wimmer,Kurt Wimmer,"Milla Jovovich, Cameron Bright, Nick Chinlund, Sebastien Andrieu, Ida Martin, William Fichtner, David E. Collier, Kieran O'Rorke, Digger Mesch, Ryan Martin, Steven Calcote, Ricardo Mamood-Vega, Mike Smith, Clay Cullen, Jennifer Caputo",4.4,78768,30.0,31.070211,849.0,161.0,1.070211,3.5673700000000004,6,2006
In cerca d'amore,2000-03-17,"Comedy, Drama",102,Gavin O'Connor,"Angela Shelton, Gavin O'Connor","Janet McTeer, Kimberly J. Brown, Jay O. Sanders, Gavin O'Connor, Laurel Holloman, Lois Smith, Michael J. Pollard, Ashley Buccille, Cody McMains, Linda Porter, Brian Tahash, Josh Carmichael, Dennis Ford, Sara Downing, Joel Polis",6.7,3211,0.312,1.350248,73.0,64.0,1.038248,332.7717948717949,3,2000
N-Secure,2010-10-15,"Crime, Drama, Thriller",105,David M. Matthews,"Julius Lewis, Christie Taylor","Cordell Moore, Essence Atkins, Denise Boutte, Tempestt Bledsoe, Lamman Rucker, Toni Trucks, Rick Ravanello, Thomas Miles, Caryn Ward, Elise Neal, Steve Conn, BernNadette Stanis, Sabrina Tiller, Michael Higgenbottom, T.J. Cates",3.4,595,1.6,2.595644,14.0,4.0,0.995644,62.22775,10,2010
Wendy and Lucy,2009-03-06,Drama,80,Kelly Reichardt,"Jonathan Raymond, Kelly Reichardt","Michelle Williams, Lucy, David Koppell, Max Clement, Sid Shanley, Dave Hubner, Michelle Worthey, Will Oldham, Wally Dalton, Roger D. Faires, Boggs Johnson, Tanya Smith, Michael Brophy, John Robinson, John Breen",7.1,16061,0.2,1.192995,125.0,190.0,0.992995,496.4975,3,2009
Signal,2008-07-04,"Horror, Sci-Fi, Thriller",103,"David Bruckner, Dan Bush","David Bruckner, Jacob Gentry","Anessa Ramsey, Sahr Ngaujah, AJ Bowen, Matthew Stanton, Suehyla El-Attar, Justin Welborn, Cheri Christian, Scott Poythress, Christopher Thomas, Lindsey Garrett, Chad McKnight, Claire Bronson, David Bruckner, Dan Bush, John Clifton",6.0,20201,0.05,1.040386,125.0,143.0,0.990386,1980.772,7,2008
Soffocare,2009-05-13,"Comedy, Drama",92,Clark Gregg,"Clark Gregg, Chuck Palahniuk","Kathryn Alexander, Teodorina Bello, Kate Blumberg, Jonah Bobo, Willi Burke, Heather Burns, David Fonteno, Matt Gerald, Clark Gregg, Joel Grey, Viola Harris, Brad William Henke, Paz de la Huerta, Michelle Hurst, Anjelica Huston",6.4,31248,3.0,3.982459,81.0,152.0,0.982459,32.74863333333333,5,2009
Donnie Darko,2004-11-19,"Drama, Mystery, Sci-Fi",113,Richard Kelly,Richard Kelly,"Jake Gyllenhaal, Holmes Osborne, Maggie Gyllenhaal, Daveigh Chase, Mary McDonnell, James Duval, Arthur Taxier, Patrick Swayze, Mark Hoffman, David St. James, Tom Tangen, Jazzie Mahannah, Jolene Purdy, Stuart Stone, Gary Lundy",8.0,728383,6.0,6.979093,2286.0,374.0,0.979093,16.318216666666665,11,2004
Batman: The Killing Joke,2016-07-25,"Animation, Action, Crime",76,Sam Liu,"Brian Azzarello, Brian Bolland","Kevin Conroy, Mark Hamill, Tara Strong, Ray Wise, John DiMaggio, Robin Atkin Downes, Brian George, JP Karliak, Andrew Kishino, Nolan North, Maury Sterling, Fred Tatasciore, Bruce Timm, Anna Vocino, Kari Wahlgren",6.4,47797,3.5,4.462034,216.0,130.0,0.962034,27.486685714285713,7,2016
Trois,2000-03-10,"Drama, Romance, Thriller",93,Rob Hardy,"Rob Hardy, Will Packer","Gary Dourdan, Gretchen Palmer, Kenya Moore, Soloman K. Smith, Thomas Jefferson Byrd, Chrystale Wilson, Bryce Wilson, Jay Jones, Tariq Holloway, Donna Biscoe, George Williams, Ron N. Binder, Gregory W. Anderson, Tom Rowley, Chato Waters",4.1,593,0.2,1.161843,20.0,2.0,0.961843,480.9215,3,2000
Filly Brown,2013-04-19,"Drama, Music",80,"Youssef Delara, Michael D. Olmos","Youssef Delara, Michael D. Olmos","Gina Rodriguez, Khool-Aid Rios, Jenni Rivera, Lou Diamond Phillips, Lala Romero, Jorge Diaz, Edward James Olmos, Emilio Rivera, Noel Gugliemi, Francine Hinostrow, Albert F. Herrera, Resmine Atis, Cuete Yeska, Daniel Edward Mora, Michelle Milan",5.7,1039,2.0,2.940411,10.0,16.0,0.940411,47.02055,4,2013
Chuck & Buck,2000-08-04,"Comedy, Drama",96,Miguel Arteta,Mike White,"Mike White, Chris Weitz, Lupe Ontiveros, Beth Colt, Paul Weitz, Maya Rudolph, Mary Wigmore, Paul Sand, Gino Buccola, Annette Murphy, Glory Simon, Douglas Kieffer, Jonathan Brown, Ruthie Bram, Giovanni Gieco",6.5,5220,0.25,1.182065,139.0,43.0,0.932065,372.826,8,2000
La notte dei morti viventi,2006-11-10,Horror,80,Jeff Broadstreet,"Robert Valding, George A. Romero","Brianna Brown, Joshua DesRoches, Sid Haig, Greg Travis, Johanna Black, Adam Chambers, Ken Ward, Alynia Phillips, Max E. Williams, Cristin Michele, Marcia Ann Burrs, Robert DiTillio, Brian La Rosa, Alan Gorg, Jason Brandt",3.1,3394,0.75,1.657729,65.0,49.0,0.907729,121.03053333333334,11,2006
Phoenix Forgotten,2017-04-21,"Horror, Mystery, Sci-Fi",87,Justin Barber,"T.S. Nowlin, Justin Barber","Florence Hartigan, Luke Spencer Roberts, Chelsea Lopez, Justin Matthews, Clint Jordan, Cyd Strittmatter, Roberto Medina, Jeanine Jackson, David Carrera, Matt Biedel, Serendipity Lilliana, Ana Dela Cruz, Jonathan Schmock, Jay Pirouznia, Kevin Boontjer",5.3,5442,2.8,3.697729,78.0,66.0,0.897729,32.06175,4,2017
Indivisible,2018-10-26,"Drama, War",119,David G. Evans,"David G. Evans, Cheryl McKay","Sarah Drew, Justin Bruening, Jason George, Tia Mowry-Hardrict, Skye P. Marshall, Tanner Stine, Madeline Carroll, Eric Close, Michael O'Neill, Lucas Shane, Samara Lee, Eddie Kaulukukui, HannahFranchesca Samuel, NaomiNoel Samuel, Michael Higgenbottom",5.8,1038,2.7,3.589633,31.0,16.0,0.889633,32.94937037037037,10,2018
Sweet Land,2008-07-31,"Drama, Romance",110,Ali Selim,"Will Weaver, Ali Selim","Elizabeth Reaser, Lois Smith, Patrick Heusinger, Stephen Pelinski, Tim Guinee, Robert Hogan, Alan Cumming, Paul Sand, Jodie Markell, Sage Kermes, Kirsten Frantzich, Stephen Yoakam, Karen Landry, James Cada, Debbie DeLisi",7.1,3605,1.0,1.843537,65.0,42.0,0.843537,84.3537,7,2008
La canzone della vita - Danny Collins,2015-04-10,"Biography, Comedy, Drama",106,Dan Fogelman,Dan Fogelman,"Al Pacino, Annette Bening, Jennifer Garner, Bobby Cannavale, Christopher Plummer, Katarina Cas, Giselle Eisenberg, Melissa Benoist, Josh Peck, Brian Thomas Smith, Scott Lawrence, Michael Patrick McGill, Kiff VandenHeuvel, Nick Offerman, Eric Michael Roy",7.0,29512,10.0,10.835752,124.0,151.0,0.835752,8.357520000000001,4,2015
Disney's Newsies: The Broadway Musical,2017-02-16,Musical,149,"Jeff Calhoun, Brett Sullivan","Harvey Fierstein, Bob Tzudiker","Jeremy Jordan, Kara Lindsay, Ben Fankhauser, Andrew Keenan-Bolger, Steve Blanchard, Aisha De Haas, Ethan Steiner, Tommy Bracco, Joshua Burrage, Ben Cook, Michael Dameski, Julian DeGuzman, Nico DeJesus, J.P. Ferreri, Sky Flaherty",8.5,1953,2.0,2.827489,19.0,1.0,0.827489,41.37445,2,2017
Morgan,2016-09-02,"Action, Horror, Sci-Fi",92,Luke Scott,Seth W. Owen,"Kate Mara, Anya Taylor-Joy, Rose Leslie, Michael Yare, Toby Jones, Chris Sullivan, Boyd Holbrook, Vinette Robinson, Michelle Yeoh, Brian Cox, Jennifer Jason Leigh, Paul Giamatti, Crispian Belfrage, Amybeth McNulty, Jonathan Aris",5.8,38340,8.0,8.809407,183.0,187.0,0.809407,10.117587499999999,9,2016
Urbania,2001-08-09,Drama,103,Jon Shear,"Daniel Reitz, Daniel Reitz","Dan Futterman, Sam Ball, Lothaire Bluteau, Alan Cumming, Josh Hamilton, Matt Keeslar, James Simon, Megan Dodds, Gabriel Olds, Barbara Sukowa, Gerry Bamman, Scott Denny, Pamela Shaw, David Wheir, Christopher Bradley",6.8,2897,0.225,1.032075,72.0,37.0,0.807075,358.70000000000005,8,2001
Kiss Kiss Bang Bang,2005-12-02,"Action, Comedy, Crime",103,Shane Black,"Brett Halliday, Shane Black","Robert Downey Jr., Val Kilmer, Michelle Monaghan, Corbin Bernsen, Dash Mihok, Larry Miller, Rockmond Dunbar, Shannyn Sossamon, Angela Lindvall, Indio Falconer Downey, Ariel Winter, Duane Carnahan, Josh Richman, Martha Hackett, Nancy Fish",7.5,211456,15.0,15.785148,383.0,235.0,0.785148,5.23432,12,2005
Personal Velocity - Il momento giusto,2003-05-16,"Drama, Romance",86,Rebecca Miller,"Rebecca Miller, Rebecca Miller","Kyra Sedgwick, Parker Posey, Fairuza Balk, John Ventimiglia, Ron Leibman, Wallace Shawn, David Warshofsky, Leo Fitzpatrick, Tim Guinee, Patti D'Arbanville, Ben Shenkman, Joel de la Fuente, Marceline Hugot, Brian Tarantina, Seth Gilliam",6.5,3471,0.125,0.890502,70.0,59.0,0.765502,612.4016,5,2003
The Singles Ward,2002-01-30,"Comedy, Drama, Romance",102,Kurt Hale,"John E. Moyer, John E. Moyer","Will Swenson, Connie Young, Daryn Tufts, Kirby Heyborne, Michael Birkeland, Robert Swenson, Lincoln Hoppe, Tarance Edwards, Michelle Ainge, Gretchen Whalley, Sedra Santos, Wally Joyner, Danny Ainge, Richard Dutcher, Shawn Bradley",6.4,1314,0.5,1.250798,53.0,5.0,0.750798,150.15959999999998,1,2002
Tangerine,2015-07-10,"Comedy, Crime, Drama",88,Sean Baker,"Sean Baker, Chris Bergoch","Kitana Kiki Rodriguez, Mya Taylor, Karren Karagulian, Mickey O'Hagan, James Ransone, Alla Tumanian, Luiza Nersisyan, Arsen Grigoryan, Ian Edwards, Clu Gulager, Ana Foxx, Scott Krinsky, Chelcie Lynn, Shih-Ching Tsou, Josh Sussman",7.1,26285,0.1,0.828874,98.0,207.0,0.728874,728.874,7,2015
Slamma Jamma,2017-03-23,"Drama, Sport",104,Timothy A. Chey,Timothy A. Chey,"Chris Staples, Michael Irvin, Jose Canseco, Ryan Gunnarson, Ray Walia, Michael Hardy, Aqueela Zoll, Kelsey Caesar, Gary Smith, Kay Wallia, Charles Hoyes, Rosemarie Smith-Coleman, Tammy Brawner, Michael Cognata, William Thomas Jones",6.1,1324,1.0,1.687,69.0,10.0,0.687,68.7,3,2017
Alone with Her,2008-07-04,"Crime, Drama, Thriller",78,Eric Nicholas,Eric Nicholas,"Colin Hanks, Ana Claudia Talancón, Jordana Spiro, Jonathon Trent, Alex Boling, Tony Armatrading, Nicole Layson, Morgan Star",6.0,3771,1.0,1.677967,34.0,71.0,0.677967,67.7967,7,2008
Girlfight,2001-03-08,"Drama, Sport",110,Karyn Kusama,Karyn Kusama,"Michelle Rodriguez, Jamie Tirelli, Paul Calderon, Santiago Douglas, Ray Santiago, Víctor Sierra, Elisa Bocanegra, Shannon Walker Williams, Louis Guss, Herb Lovelle, Thomas Barbour, Graciella Ortiz, J.P. Linton, Iris Little Thomas, Dadi Pinero",6.7,9264,1.0,1.666028,92.0,98.0,0.666028,66.6028,3,2001
The R.M.,2003-01-31,"Comedy, Crime, Family",101,Kurt Hale,"Kurt Hale, John E. Moyer","Kirby Heyborne, Daryn Tufts, Will Swenson, Britani Bateman Underwood, Tracy Ann Evans, Merrill Dodge, Michael Birkeland, Maren Ord, Big Budah, Curt Doussett, Wally Joyner, Jericho Road, Gary Crowton, Rulon Gardner, Larry H. Miller",6.1,748,0.5,1.111615,33.0,3.0,0.611615,122.32300000000001,1,2003
2 gran figli di...,2018-03-01,"Comedy, Drama",113,Lawrence Sher,Justin Malen,"Robert Jon Mello, Ed Helms, Retta, Zachary Haven, Mary Grill, Glenn Close, Ann McKenzie, Owen Wilson, Jessica Gomes, Harry Shearer, Sarah Skeist, Jo Helton, Terry Bradshaw, Debra Stipe, Ving Rhames",5.5,17279,25.0,25.601244,99.0,60.0,0.601244,2.404976,3,2018
Primer,2005-05-27,"Drama, Sci-Fi, Thriller",77,Shane Carruth,Shane Carruth,"Shane Carruth, David Sullivan, Casey Gooden, Anand Upadhyaya, Carrie Crawford, Jay Butler, John Carruth, Juan Tapia, Ashley Warren, Samantha Thomson, Chip Carruth, Delaney Price, Jack Pyland, Keith Bradshaw, Ashok Upadhyaya",6.9,96229,0.007,0.545436,462.0,134.0,0.538436,7691.942857142857,5,2005
Upstream Color,2013-08-30,"Drama, Sci-Fi",96,Shane Carruth,Shane Carruth,"Amy Seimetz, Shane Carruth, Andrew Sensenig, Thiago Martins, Kathy Carruth, Meredith Burke, Andreon Watson, Ashton Miramontes, Myles McGee, Frank Mosley, Carolyn King, Kerry McCormick, Marco Antonio Rodriguez, Brina Palencia, Lynn Blackburn",6.7,30920,0.05,0.587174,172.0,277.0,0.537174,1074.348,8,2013
Le squillo della porta accanto,2012-11-02,Comedy,85,Jamie Travis,"Katie Anne Naylon, Lauren Miller Rogen","Lauren Miller Rogen, James Wolk, Ari Graynor, Justin Long, Lawrence A. Mandley, Eddie Geller, Josh Ruben, Steven Shaw, Mimi Rogers, Don McManus, Mark Webber, Nia Vardalos, Kevin Smith, Sugar Lyn Beard, Seth Rogen",6.0,15526,0.85,1.386088,37.0,115.0,0.536088,63.06917647058824,11,2012
