title,date_published,genre,duration,director,writer,actors,avg_vote,votes,budget,worlwide_gross_income,reviews_from_users,reviews_from_critics,profit,roi,release_month,release_year
Secret Window,2004-04-16,"Drama, Mystery, Thriller",96,David Koepp,"Stephen King, David Koepp","Johnny Depp, John Turturro, Maria Bello, Timothy Hutton, Charles S. Dutton, Len Cariou, Joan Heney, John Dunn-Hill, Vlasta Vrana, Matt Holland, Gillian Ferrabee, Bronwen Mantel, Elizabeth Marleau, Kyle Allatt, Richard Jutras",6.6,178782,40.0,92.913171,564.0,188.0,52.913171,132.2829275,4,2004
Devil,2010-11-12,"Horror, Mystery, Thriller",80,John Erick Dowdle,"Brian Nelson, M. Night Shyamalan","Chris Messina, Logan Marshall-Green, Jenny O'Hara, Bojana Novakovic, Bokeem Woodbine, Geoffrey Arend, Jacob Vargas, Matt Craven, Joshua Peace, Caroline Dhavernas, Joe Cobden, Zoie Palmer, Vincent Laresca, Rudy Webb, Craig Eldridge",6.2,127717,10.0,62.695489,360.0,278.0,52.695489,526.95489,11,2010
Collateral Beauty,2017-01-04,"Drama, Romance",97,David Frankel,Allan Loeb,"Will Smith, Edward Norton, Kate Winslet, Michael Peña, Helen Mirren, Naomie Harris, Keira Knightley, Jacob Latimore, Ann Dowd, Liza Colón-Zayas, Natalie Gold, Kylie Rogers, Shirley Rumierk, Alyssa Cheatham, Benjamin Snyder",6.8,88991,36.0,88.52828,376.0,198.0,52.52828,145.91188888888888,1,2017
Il destino di un cavaliere,2001-11-09,"Action, Adventure, Romance",132,Brian Helgeland,Brian Helgeland,"Heath Ledger, Rufus Sewell, Shannyn Sossamon, Paul Bettany, Laura Fraser, Mark Addy, Alan Tudyk, Bérénice Bejo, Scott Handy, James Purefoy, Leagh Conwell, Christopher Cazenove, Steven O'Donnell, Jonathan Slinger, Nick Brimble",6.9,167807,65.0,117.487473,702.0,170.0,52.487473,80.74995846153847,11,2001
Moonrise Kingdom - Una fuga d'amore,2012-12-05,"Comedy, Drama, Romance",94,Wes Anderson,"Wes Anderson, Roman Coppola","Bruce Willis, Edward Norton, Bill Murray, Frances McDormand, Tilda Swinton, Jared Gilman, Kara Hayward, Jason Schwartzman, Bob Balaban, Lucas Hedges, Charlie Kilgore, Andreas Sheikh, Chandler Frantz, Rob H. Campbell, L.J. Foley",7.8,311669,16.0,68.263166,443.0,506.0,52.263166,326.6447875,12,2012
What Men Want,2019-02-08,"Comedy, Fantasy, Romance",117,Adam Shankman,"Tina Gordon, Peter Huyck","Taraji P. Henson, Kristen Ledlow, Josh Brener, Kellan Lutz, Jason Jones, Justin Alvarez, Chris Witaske, Max Greenfield, Paul Brian Johnson, Brian Bosworth, Kausar Mohammed, Richard Roundtree, Taj-Naranja Jenkines, Aldis Hodge, Auston Jon Moore",5.2,20016,20.0,72.216294,285.0,86.0,52.216294,261.08147,2,2019
Surf's Up - I re delle onde,2007-10-05,"Animation, Comedy, Family",85,"Ash Brannon, Chris Buck","Don Rhymer, Ash Brannon","Shia LaBeouf, Jeff Bridges, Zooey Deschanel, Jon Heder, James Woods, Diedrich Bader, Mario Cantone, Kelly Slater, Rob Machado, Sal Masekela, Ash Brannon, Chris Buck, Brian Posehn, Dana Belben, Reed Buck",6.7,67541,100.0,152.005713,130.0,161.0,52.005713,52.005713,10,2007
"I Love You, Man",2009-08-21,"Comedy, Romance",105,John Hamburg,"John Hamburg, Larry Levin","Paul Rudd, Rashida Jones, Sarah Burns, Greg Levine, Jaime Pressly, Jon Favreau, Jane Curtin, J.K. Simmons, Andy Samberg, Jean Villepique, Rob Huebel, Kym Whitley, Colleen Crabtree, Caroline Farah, Mather Zickel",7.0,191738,40.0,91.980359,235.0,227.0,51.980359,129.9508975,8,2009
Behind Enemy Lines - Dietro le linee nemiche,2002-01-11,"Action, Drama, Thriller",106,John Moore,"Jim Thomas, John Thomas","Owen Wilson, Gene Hackman, Gabriel Macht, Charles Malik Whitfield, Joaquim de Almeida, David Keith, Olek Krupa, Vladimir Mashkov, Marko Igonda, Eyal Podell, Geoff Pierson, Aernout Van Lynden, Sam Jaeger, Shane Johnson, Don Winston",6.4,97575,40.0,91.753202,437.0,138.0,51.753202,129.383005,1,2002
In viaggio con una rock star,2011-07-08,"Comedy, Music",109,Nicholas Stoller,"Nicholas Stoller, Jason Segel","Russell Brand, Rose Byrne, Tyler McKinney, Zoe Salmon, Lino Facioli, Lars Ulrich, Mario Lopez, Pink, Billy Bush, Kurt Loder, Christina Aguilera, Colm Meaney, Ray Siegle, Chad Cleven, Jonathan Chris Lopez",6.4,168032,40.0,91.720255,224.0,215.0,51.720255,129.3006375,7,2011
L'ultimo dei Templari,2011-06-15,"Action, Adventure, Fantasy",95,Dominic Sena,Bragi F. Schut,"Nicolas Cage, Ron Perlman, Stephen Campbell Moore, Stephen Graham, Ulrich Thomsen, Claire Foy, Robert Sheehan, Christopher Lee, Kevin Rees, Andrew Hefler, Fernanda Dorogi, Rebekah Kennedy, Matt Devere, Róbert Bánlaki, Barna Illyés",5.4,89377,40.0,91.627228,254.0,290.0,51.627228,129.06807,6,2011
Noi siamo tutto,2017-09-21,"Drama, Romance",96,Stella Meghie,"J. Mills Goodloe, Nicola Yoon","Amandla Stenberg, Nick Robinson, Anika Noni Rose, Ana de la Reguera, Taylor Hickson, Danube Hermosillo, Dan Payne, Fiona Loewi, Sage Brocklebank, Robert Lawrenson, Peter Benson, Françoise Yip, Farryn VanHumbeck, Marion Eisman, Allison Riley",6.4,31590,10.0,61.62114,125.0,102.0,51.62114,516.2114,9,2017
Diario di una schiappa 2,2011-03-25,"Comedy, Family",100,David Bowers,"Gabe Sachs, Jeff Judah","Zachary Gordon, Devon Bostick, Rachael Harris, Robert Capron, Steve Zahn, Connor Fielding, Owen Fielding, Peyton List, Karan Brar, Laine MacNeil, Grayson Russell, Terence Kelly, Fran Kranz, Bryce Hodgson, Andrew McNee",6.5,25466,21.0,72.526996,55.0,103.0,51.526996,245.3666476190476,3,2011
The Big Sick - Il matrimonio si può evitare... l'amore no,2017-11-16,"Comedy, Drama, Romance",120,Michael Showalter,"Emily V. Gordon, Kumail Nanjiani","Kumail Nanjiani, Zoe Kazan, Holly Hunter, Ray Romano, Anupam Kher, Zenobia Shroff, Adeel Akhtar, Bo Burnham, Aidy Bryant, Kurt Braunohler, Vella Lovell, Myra Lucretia Taylor, Jeremy Shamos, David Alan Grier, Ed Herbstman",7.5,117533,5.0,56.411585,362.0,337.0,51.411585,1028.2317,11,2017
Holes - Buchi nel deserto,2003-08-15,"Adventure, Comedy, Drama",117,Andrew Davis,"Louis Sachar, Louis Sachar","Sigourney Weaver, Jon Voight, Tim Blake Nelson, Shia LaBeouf, Khleo Thomas, Jake M. Smith, Byron Cotton, Brenden Jefferson, Miguel Castro, Max Kasch, Noah Poletiek, Zane Holtz, Steven Kozlowski, Ski Carr, Jim Wilkey",7.0,75840,20.0,71.406573,347.0,107.0,51.406573,257.032865,8,2003
Sky High - Scuola di superpoteri,2005-10-21,"Adventure, Comedy, Family",100,Mike Mitchell,"Paul Hernandez, Bob Schooley","Michael Angarano, Kurt Russell, Kelly Preston, Danielle Panabaker, Christopher Wynne, Kevin Heffernan, Dee Jay Daniels, Kelly Vitz, Loren Berman, Nicholas Braun, Malika Haqq, Khadijah Haqq, Jake Sandvig, Will Harris, Mary Elizabeth Winstead",6.2,77336,35.0,86.369815,243.0,135.0,51.369815,146.77089999999998,10,2005
Il petroliere,2008-02-15,Drama,158,Paul Thomas Anderson,"Paul Thomas Anderson, Upton Sinclair","Daniel Day-Lewis, Martin Stringer, Matthew Braden Stringer, Jacob Stringer, Joseph Mussey, Barry Del Sherman, Harrison Taylor, Stockton Taylor, Paul F. Tompkins, Dillon Freasier, Kevin Breznahan, Jim Meskimen, Erica Sullivan, Randall Carver, Coco Leigh",8.2,502968,25.0,76.181545,1327.0,344.0,51.181545,204.72617999999997,2,2008
Dallas Buyers Club,2014-01-30,"Biography, Drama",117,Jean-Marc Vallée,"Craig Borten, Melisa Wallack","Matthew McConaughey, Jennifer Garner, Jared Leto, Denis O'Hare, Steve Zahn, Michael O'Neill, Dallas Roberts, Griffin Dunne, Kevin Rankin, Donna Duplantier, Deneen Tyler, J.D. Evermore, Ian Casselberry, Noelle Wilcox, Bradford Cox",8.0,430111,5.0,55.736588,416.0,486.0,50.736588,1014.7317599999999,1,2014
Big Mama: Tale padre tale figlio,2011-07-08,"Action, Comedy, Crime",107,John Whitesell,"Matthew Fogel, Don Rhymer","Martin Lawrence, Brandon T. Jackson, Jessica Lucas, Michelle Ang, Portia Doubleday, Emily Rios, Ana Ortiz, Henri Lubatti, Lorenzo Pisoni, Tony Curran, Marc John Jefferies, Brandon Gill, Zack Mines, Rhett Lindsey, Ken Jeong",4.4,25033,32.0,82.686066,52.0,88.0,50.686066,158.39395625,7,2011
Nella tana dei lupi,2018-04-05,"Action, Crime, Drama",140,Christian Gudegast,"Christian Gudegast, Christian Gudegast","Gerard Butler, Pablo Schreiber, O'Shea Jackson Jr., 50 Cent, Meadow Williams, Maurice Compte, Brian Van Holt, Evan Jones, Mo McRae, Kaiwi Lyman, Dawn Olivieri, Eric Braeden, Jordan Bridges, Lewis Tan, Cooper Andrews",7.0,88814,30.0,80.509622,516.0,182.0,50.509622,168.36540666666667,4,2018
I Tenenbaum,2002-03-29,"Comedy, Drama",110,Wes Anderson,"Wes Anderson, Owen Wilson","Gene Hackman, Anjelica Huston, Ben Stiller, Gwyneth Paltrow, Luke Wilson, Owen Wilson, Bill Murray, Danny Glover, Seymour Cassel, Kumar Pallana, Alec Baldwin, Grant Rosenmeyer, Jonah Meyerson, Aram Aslanian-Persico, Irina Gorovaia",7.6,260939,21.0,71.44125,985.0,230.0,50.44125,240.19642857142856,3,2002
Men of Honor - L'onore degli uomini,2001-04-13,"Biography, Drama",129,George Tillman Jr.,Scott Marshall Smith,"Robert De Niro, Cuba Gooding Jr., Charlize Theron, Aunjanue Ellis, Hal Holbrook, Michael Rapaport, Powers Boothe, David Keith, Holt McCallany, David Conrad, Joshua Leonard, Carl Lumbly, Lonette McKee, Glynn Turman, Dennis Troutman",7.2,105471,32.0,82.343495,247.0,104.0,50.343495,157.32342187499998,4,2001
Libera uscita,2011-06-15,"Comedy, Romance",105,"Bobby Farrelly, Peter Farrelly","Pete Jones, Peter Farrelly","Owen Wilson, Jason Sudeikis, Jenna Fischer, Christina Applegate, Nicky Whelan, Richard Jenkins, Stephen Merchant, Larry Joe Campbell, Bruce Thomas, Tyler Hoechlin, Derek Waters, Alexandra Daddario, Rob Moran, Lauren Bowles, Christa Beth Campbell",5.8,118561,36.0,86.157237,174.0,239.0,50.157237,139.32565833333334,6,2011
Prendimi!,2018-07-05,"Action, Comedy",100,Jeff Tomsic,"Rob McKittrick, Mark Steilen","Ed Helms, Lil Rel Howery, Jon Hamm, Annabelle Wallis, Jake Johnson, Isla Fisher, Hannibal Buress, Nora Dunn, Steve Berg, Jeremy Renner, Leslie Bibb, Rashida Jones, Indiana Sifuentes, Trayce Malachi, Jock McKissic",6.5,109263,28.0,78.130625,478.0,195.0,50.130625,179.03794642857142,7,2018
Ipotesi di reato,2002-10-04,"Drama, Thriller",98,Roger Michell,"Chap Taylor, Chap Taylor","Ben Affleck, Samuel L. Jackson, Kim Staunton, Toni Collette, Sydney Pollack, Tina Sloan, Richard Jenkins, Akil Walker, Cole Hawkins, Ileen Getz, Jennifer Dundas, Matt Malloy, Amanda Peet, Myra Lucretia Taylor, Bruce Altman",6.4,66104,45.0,94.935764,360.0,165.0,49.935764,110.96836444444445,10,2002
J. Edgar,2012-01-04,"Biography, Drama, Romance",137,Clint Eastwood,Dustin Lance Black,"Leonardo DiCaprio, Josh Hamilton, Geoff Pierson, Cheryl Lawson, Kaitlyn Dever, Brady Matthews, Gunner Wright, David A. Cooper, Ed Westwick, Naomi Watts, Kelly Lester, Jack Donner, Judi Dench, Dylan Burns, Jordan Bridges",6.5,120851,35.0,84.920539,294.0,410.0,49.920539,142.63011142857144,1,2012
The Boss,2016-06-16,Comedy,99,Ben Falcone,"Melissa McCarthy, Ben Falcone","Melissa McCarthy, Kristen Bell, Peter Dinklage, Ella Anderson, Tyler Labine, Kathy Bates, Cecily Strong, Mary Sohn, Kristen Schaal, Eva Peterson, Timothy Simons, Aleandra Newcomb, Annie Mumolo, Presley Coley, Dax Shepard",5.4,42072,29.0,78.844582,157.0,179.0,49.844582,171.87786896551725,6,2016
Il libro della vita,2015-05-28,"Animation, Adventure, Comedy",95,Jorge R. Gutiérrez,"Jorge R. Gutiérrez, Doug Langdale","Diego Luna, Zoe Saldana, Channing Tatum, Ron Perlman, Christina Applegate, Ice Cube, Kate del Castillo, Hector Elizondo, Danny Trejo, Carlos Alazraqui, Ana de la Reguera, Emil-Bastien Bouffard, Elijah Rodriguez, Genesis Ochoa, Plácido Domingo",7.3,63206,50.0,99.783556,139.0,163.0,49.783556,99.56711200000001,5,2015
Letters to Juliet,2010-08-25,"Adventure, Comedy, Drama",105,Gary Winick,"Jose Rivera, Tim Sullivan","Amanda Seyfried, Marcia DeBonis, Gael García Bernal, Giordano Formenti, Paolo Arvedi, Dario Conti, Ivana Lotito, Luisa Ranieri, Marina Massironi, Lidia Biondi, Milena Vukotic, Luisa De Santis, Christopher Egan, Vanessa Redgrave, Remo Remotti",6.5,90637,30.0,79.62883,182.0,163.0,49.62883,165.42943333333332,8,2010
Snow Day,2000-12-01,"Adventure, Comedy, Family",89,Chris Koch,"Will McRobb, Chris Viscardi","Chris Elliott, Mark Webber, Jean Smart, Schuyler Fisk, Iggy Pop, Pam Grier, John Schneider, Chevy Chase, Zena Grey, Josh Peck, Jade Yorker, Damian Young, Connor Matheus, J. Adam Brown, Emmanuelle Chriqui",5.1,11354,13.0,62.464731,102.0,35.0,49.464731,380.4979307692308,12,2000
"Tuo, Simon",2018-05-31,"Comedy, Drama, Romance",110,Greg Berlanti,"Becky Albertalli, Elizabeth Berger","Nick Robinson, Jennifer Garner, Josh Duhamel, Katherine Langford, Alexandra Shipp, Logan Miller, Keiynan Lonsdale, Jorge Lendeborg Jr., Talitha Eliana Bateman, Tony Hale, Natasha Rothwell, Miles Heizer, Joey Pollari, Clark Moore, Drew Starkey",7.6,94565,17.0,66.316289,539.0,258.0,49.316289,290.0958176470588,5,2018
I segreti di Osage County,2014-01-30,"Comedy, Drama",121,John Wells,"Tracy Letts, Tracy Letts","Meryl Streep, Julia Roberts, Chris Cooper, Ewan McGregor, Margo Martindale, Sam Shepard, Dermot Mulroney, Julianne Nicholson, Juliette Lewis, Abigail Breslin, Benedict Cumberbatch, Misty Upham, Will Coffey, Newell Alexander, Jerry Stahl",7.2,83412,25.0,74.188937,317.0,319.0,49.188937,196.75574799999998,1,2014
Crossroads - Le strade della vita,2002-03-22,"Comedy, Drama, Romance",93,Tamra Davis,Shonda Rhimes,"Britney Spears, Anson Mount, Zoe Saldana, Taryn Manning, Dan Aykroyd, Kim Cattrall, Justin Long, Beverly Johnson, Bahni Turpin, Kool Moe Dee, Richard Voll, Katherine Boecher, Dave Allen, Kyle Davis, Branden Williams",3.5,38047,12.0,61.14103,576.0,117.0,49.14103,409.5085833333333,3,2002
Son of God,2014-02-28,"Biography, Drama, History",138,Christopher Spencer,"Richard Bedser, Christopher Spencer","Diogo Morgado, Greg Hicks, Adrian Schiller, Darwin Shaw, Sebastian Knapp, Joe Wredden, Simon Kunz, Paul Marc Davis, Matthew Gravelle, Amber Rose Revah, Roma Downey, Paul Knops, Darcie Lincoln, David Rintoul, Gary Oliver",5.7,18152,22.0,70.82927,187.0,62.0,48.82927,221.95122727272727,2,2014
Next Friday,2000-01-12,Comedy,98,Steve Carr,"Ice Cube, DJ Pooh","Ice Cube, Mike Epps, Justin Pierce, John Witherspoon, Don 'D.C.' Curry, Jacob Vargas, Lobo Sebastian, Rolando Molina, Lisa Rodríguez, Tommy 'Tiny' Lister, Kym Whitley, Amy Hill, Tamala Jones, The Lady of Rage, Carmen Serano",6.2,36064,11.0,59.827328,88.0,17.0,48.827328,443.88480000000004,1,2000
Il ragazzo della porta accanto,2015-07-23,"Horror, Thriller",91,Rob Cohen,Barbara Curry,"Jennifer Lopez, Ryan Guzman, Ian Nelson, John Corbett, Kristin Chenoweth, Lexi Atkins, Hill Harper, Jack Wallace, Adam Hicks, François Chau, Bailey Chase, Kent Avenido, Travis Schuldt, Brian Mahoney, Raquel Gardner",4.7,37341,4.0,52.425855,163.0,272.0,48.425855,1210.646375,7,2015
The Perfect Guy,2015-09-11,"Crime, Drama, Horror",100,David M. Rosenthal,"Alan B. McElroy, Tyger Williams","Sanaa Lathan, Michael Ealy, Morris Chestnut, L. Scott Caldwell, Charles S. Dutton, John Getz, Tess Harper, Kathryn Morris, Rutina Wesley, Holt McCallany, Jessica Parker Kennedy, David Starzyk, Ronnie Gene Blevins, Wilmer Calderon, Gordon Clapp",5.6,9645,12.0,60.273173,48.0,49.0,48.273173,402.2764416666667,9,2015
Boxtrolls - Le scatole magiche,2014-10-02,"Animation, Adventure, Comedy",96,"Graham Annable, Anthony Stacchi","Irena Brignull, Adam Pava","Steve Blum, Dee Bradley Baker, Max Mitchell, Ben Kingsley, Jared Harris, Nick Frost, Richard Ayoade, Tracy Morgan, Nika Futterman, Pat Fraley, Fred Tatasciore, Isaac Hempstead Wright, Elle Fanning, Maurice LaMarche, James Urbaniak",6.8,53484,60.0,108.25577,143.0,237.0,48.25577,80.42628333333333,10,2014
End of Watch - Tolleranza zero,2012-11-22,"Action, Crime, Drama",109,David Ayer,David Ayer,"Jake Gyllenhaal, Michael Peña, Natalie Martinez, Anna Kendrick, David Harbour, Frank Grillo, America Ferrera, Cle Sloan, Jaime FitzSimons, Cody Horn, Shondrella Avery, Everton Lawrence, Leequwid 'Devil' Wilkens, James 'Pistol' McNeal, Zone",7.6,224496,7.0,55.078146,411.0,370.0,48.078146,686.8306571428571,11,2012
Number 23,2007-04-23,"Crime, Mystery, Thriller",98,Joel Schumacher,Fernley Phillips,"Jim Carrey, Virginia Madsen, Logan Lerman, Danny Huston, Lynn Collins, Rhona Mitra, Michelle Arthur, Mark Pellegrino, Paul Butcher, David Stifel, Corey Stoll, Ed Lauter, Troy Kotsur, Walter Soo Hoo, Patricia Belcher",6.4,191157,30.0,77.677553,417.0,220.0,47.677553,158.92517666666666,4,2007
Four Brothers - Quattro fratelli,2005-10-07,"Action, Crime, Drama",109,John Singleton,"David Elliot, Paul Lovett","Mark Wahlberg, Tyrese Gibson, André Benjamin, Garrett Hedlund, Terrence Howard, Josh Charles, Sofía Vergara, Fionnula Flanagan, Chiwetel Ejiofor, Taraji P. Henson, Barry Shabaka Henley, Jernard Burks, Kenneth Welsh, Tony Nappo, Shawn Singleton",6.8,132163,45.0,92.374674,362.0,129.0,47.374674,105.27705333333333,10,2005
Un milione di modi per morire nel West,2014-05-30,"Comedy, Western",116,Seth MacFarlane,"Seth MacFarlane, Alec Sulkin","Seth MacFarlane, Charlize Theron, Amanda Seyfried, Liam Neeson, Giovanni Ribisi, Neil Patrick Harris, Sarah Silverman, Christopher Hagen, Wes Studi, Matt Clark, Evan Jones, Aaron McPherson, Rex Linn, Brett Rickaby, Alex Borstein",6.1,169209,40.0,87.189756,523.0,302.0,47.189756,117.97439,5,2014
ParaNorman,2012-10-11,"Animation, Adventure, Comedy",92,"Chris Butler, Sam Fell",Chris Butler,"Kodi Smit-McPhee, Tucker Albrizzi, Anna Kendrick, Casey Affleck, Christopher Mintz-Plasse, Leslie Mann, Jeff Garlin, Elaine Stritch, Bernard Hill, Jodelle Ferland, Tempestt Bledsoe, Alex Borstein, John Goodman, Hannah Noyes, Jack Blessing",7.0,91948,60.0,107.139399,203.0,341.0,47.139399,78.565665,10,2012
Abduction - Riprenditi la tua vita,2011-10-07,"Action, Mystery, Thriller",106,John Singleton,Shawn Christensen,"Jake Andolina, Oriah Acima Andrews, Ken Arnold, Maria Bello, Steve Blass, Derek Burnell, Benjamin J. Cain Jr., Holly Scott Cavanaugh, Radick Cembrzynski, Richard Cetrone, Mike Clark, Lily Collins, Jack Erdie, Rita Gregory, Tim Griffin",5.1,75475,35.0,82.087155,199.0,186.0,47.087155,134.53472857142856,10,2011
Madea protezione testimoni,2012-06-29,"Comedy, Crime, Drama",114,Tyler Perry,"Tyler Perry, Tyler Perry","Tyler Perry, Eugene Levy, Denise Richards, Doris Roberts, Romeo Miller, Tom Arnold, John Amos, Marla Gibbs, Danielle Campbell, Devan Leos, Shayne Anderson, Dean Balkwill, Nelson Bonilla, Frank Brennan, Eric Brooks",4.9,9945,20.0,66.899242,52.0,29.0,46.899242,234.49621000000002,6,2012
I sublimi segreti delle Ya-Ya Sisters,2002-10-18,Drama,116,Callie Khouri,"Rebecca Wells, Mark Andrus","Sandra Bullock, Ellen Burstyn, Fionnula Flanagan, James Garner, Cherry Jones, Ashley Judd, Shirley Knight, Angus Macfadyen, Maggie Smith, Jacqueline McKenzie, Katy Selverstone, Kiersten Warren, David Lee Smith, Gina McKee, Matthew Settle",6.1,17846,27.0,73.83924,199.0,95.0,46.83924,173.47866666666667,10,2002
The Lincoln Lawyer,2011-03-18,"Crime, Drama, Thriller",118,Brad Furman,"John Romano, Michael Connelly","Matthew McConaughey, Marisa Tomei, Ryan Phillippe, William H. Macy, Josh Lucas, John Leguizamo, Michael Peña, Bob Gunton, Frances Fisher, Bryan Cranston, Trace Adkins, Laurence Mason, Margarita Levieva, Pell James, Shea Whigham",7.3,209759,40.0,86.752352,261.0,284.0,46.752352,116.88088,3,2011
Krampus: Natale non è sempre Natale,2015-12-04,"Comedy, Drama, Fantasy",98,Michael Dougherty,"Todd Casey, Michael Dougherty","Emjay Anthony, Adam Scott, Toni Collette, Stefania LaVie Owen, Krista Stadler, Conchata Ferrell, Allison Tolman, David Koechner, Maverick Flack, Queenie Samuel, Lolo Owen, Sage Hunefeld, Leith Towers, Curtis Vowell, Luke Hawker",6.1,60237,15.0,61.548707,302.0,259.0,46.548707,310.3247133333333,12,2015
La notte non aspetta,2008-04-11,"Action, Crime, Drama",109,David Ayer,"James Ellroy, Kurt Wimmer","Keanu Reeves, Forest Whitaker, Hugh Laurie, Chris Evans, Cedric the Entertainer, Jay Mohr, Terry Crews, Naomie Harris, Common, Cle Sloan, Martha Higareda, John Corbett, Amaury Nolasco, Game, Noel Gugliemi",6.8,106070,20.0,66.476363,211.0,198.0,46.476363,232.38181500000002,4,2008
Vita da strega,2005-09-30,"Comedy, Fantasy, Romance",102,Nora Ephron,"Nora Ephron, Delia Ephron","Nicole Kidman, Will Ferrell, Shirley MacLaine, Michael Caine, Jason Schwartzman, Kristin Chenoweth, Heather Burns, Jim Turner, Stephen Colbert, David Alan Grier, Michael Badalucco, Carole Shelley, Steve Carell, Katie Finneran, James Lipton",4.8,67997,85.0,131.426169,521.0,172.0,46.426169,54.61902235294117,9,2005
Terra di confine - Open Range,2004-03-05,"Action, Drama, Romance",139,Kevin Costner,"Lauran Paine, Craig Storper","Robert Duvall, Kevin Costner, Annette Bening, Michael Gambon, Michael Jeter, Diego Luna, James Russo, Abraham Benrubi, Dean McDermott, Kim Coates, Herb Kohler, Peter MacNeill, Cliff Saunders, Patricia Stutz, Julian Richings",7.4,65567,22.0,68.296293,530.0,161.0,46.296293,210.43769545454546,3,2004
La guerra dei sessi,2014-06-20,"Comedy, Romance",106,Tim Story,"Keith Merryman, David A. Newman","Adam Brody, Michael Ealy, Jerry Ferrara, Meagan Good, Regina Hall, Dennis Haysbert, Taraji P. Henson, Terrence Jenkins, Jenifer Lewis, Romany Malco, Wendi McLendon-Covey, Gary Owen, Gabrielle Union, David Walton, Kevin Hart",5.8,19525,24.0,70.181428,42.0,53.0,46.181428,192.42261666666667,6,2014
Jeepers Creepers - Il canto del diavolo 2,2004-03-05,Horror,106,Victor Salva,"Victor Salva, Victor Salva","Ray Wise, Jonathan Breck, Garikayi Mutambirwa, Eric Nenninger, Nicki Aycox, Travis Schiffner, Lena Cardwell, Billy Aaron Brown, Marieh Delfino, Diane Delano, Thom Gossom Jr., Tom Tarantini, Al Santos, Josh Hammond, Kasan Butcher",5.6,57297,17.0,63.102666,337.0,175.0,46.102666,271.1921529411765,3,2004
Underworld: Blood Wars,2017-04-06,"Action, Adventure, Fantasy",91,Anna Foerster,"Cory Goodman, Kyle Ward","Kate Beckinsale, Theo James, Tobias Menzies, Lara Pulver, Charles Dance, James Faulkner, Peter Andersson, Clementine Nicholson, Bradley James, Daisy Head, Oliver Stark, Zuzana Stivínová, Brian Caspe, Jan Nemejovský, Sveta Driga",5.8,68137,35.0,81.093313,218.0,183.0,46.093313,131.69518,4,2017
Prime,2006-02-10,"Comedy, Drama, Romance",105,Ben Younger,Ben Younger,"Uma Thurman, Meryl Streep, Bryan Greenberg, Jon Abrahams, Adriana Biasi, David Younger, Palmer Brown, Zak Orth, Annie Parisse, Aubrey Dollar, Jerry Adler, Doris Belack, Ato Essandoh, David Anzuelo, Naomi Aborn",6.2,39316,22.0,67.937494,202.0,125.0,45.937494,208.8067909090909,2,2006
Napoleon Dynamite,2005-11-04,Comedy,96,Jared Hess,"Jared Hess, Jerusha Hess","Jon Heder, Jon Gries, Aaron Ruell, Efren Ramirez, Diedrich Bader, Tina Majorino, Sandy Martin, Haylie Duff, Trevor Snarr, Shondrella Avery, Bracken Johnson, Carmen Brady, Ellen Dubin, J.C. Cunningham, Jimmy Stevens",6.9,194951,0.4,46.138887,1555.0,217.0,45.738887,11434.72175,11,2005
Galaxy Quest,2000-11-24,"Adventure, Comedy, Sci-Fi",102,Dean Parisot,"David Howard, David Howard","Tim Allen, Sigourney Weaver, Alan Rickman, Tony Shalhoub, Sam Rockwell, Daryl Mitchell, Enrico Colantoni, Robin Sachs, Patrick Breen, Missi Pyle, Jed Rees, Justin Long, Jeremy Howard, Kaitlin Cullum, Jonathan Feyer",7.3,146064,45.0,90.683916,672.0,101.0,45.683916,101.51981333333333,11,2000
Whiplash,2015-02-12,"Drama, Music",106,Damien Chazelle,Damien Chazelle,"Miles Teller, J.K. Simmons, Paul Reiser, Melissa Benoist, Austin Stowell, Nate Lang, Chris Mulkey, Damon Gupton, Suanne Spoke, Max Kasch, Charlie Ian, Jayson Blair, Kofi Siriboe, Kavita Patil, C.J. Vana",8.5,690732,3.3,48.98326,1213.0,583.0,45.68326,1384.3412121212123,2,2015
Squadra 49,2005-02-04,"Action, Drama, Thriller",115,Jay Russell,Lewis Colick,"Joaquin Phoenix, John Travolta, Jacinda Barrett, Robert Patrick, Morris Chestnut, Billy Burke, Balthazar Getty, Tim Guinee, Kevin Chapman, Jay Hernandez, Kevin Daniels, Steve Maye, Robert Lewis, Brooke Hamlin, Spencer Berglund",6.5,54336,55.0,100.572044,326.0,106.0,45.572044,82.85826181818182,2,2005
The Lone Ranger,2013-07-03,"Action, Adventure, Comedy",150,Gore Verbinski,"Justin Haythe, Ted Elliott","Johnny Depp, Armie Hammer, William Fichtner, Tom Wilkinson, Ruth Wilson, Helena Bonham Carter, James Badge Dale, Bryant Prince, Barry Pepper, Mason Cook, JD Cullum, Saginaw Grant, Harry Treadaway, James Frain, Joaquín Cosio",6.4,218067,215.0,260.502115,770.0,467.0,45.502115,21.16377441860465,7,2013
La coniglietta di casa,2008-12-05,"Comedy, Romance",97,Fred Wolf,"Karen McCullah, Kirsten Smith","Anna Faris, Colin Hanks, Emma Stone, Kat Dennings, Hugh Hefner, Christopher McDonald, Beverly D'Angelo, Katharine McPhee, Rumer Willis, Kiely Williams, Dana Goodman, Kimberly Makkouk, Monet Mazur, Tyson Ritter, Sarah Wright",5.5,78215,25.0,70.439696,149.0,132.0,45.439696,181.75878400000002,12,2008
Faccia a faccia,2001-04-27,"Comedy, Family, Fantasy",104,Jon Turteltaub,Audrey Wells,"Bruce Willis, Spencer Breslin, Emily Mortimer, Lily Tomlin, Jean Smart, Chi McBride, Daniel von Bargen, Dana Ivey, Susan Dalian, Stanley Anderson, Juanita Moore, Esther Scott, Deborah May, Vernee Watson, Jan Hoag",6.1,39692,65.0,110.31758,146.0,91.0,45.31758,69.71935384615384,4,2001
Gangster Squad,2013-02-21,"Action, Crime, Drama",113,Ruben Fleischer,"Will Beall, Paul Lieberman","Sean Penn, Holt McCallany, Wade Williams, James Landry Hébert, Ambyr Childers, Josh Brolin, Mick Betancourt, Mac Brandt, Brandon Molale, Michael Papajohn, Jeff Wolfe, Anthony Molinari, Austin Highsmith, Ryan Gosling, Neil Koppel",6.7,203841,60.0,105.200903,306.0,433.0,45.200903,75.33483833333334,2,2013
Amori e Sparatorie,2005-02-25,"Comedy, Drama, Romance",116,Darren Grant,"Tyler Perry, Tyler Perry","Kimberly Elise, Steve Harris, Tyler Perry, Shemar Moore, Lisa Marcos, Tamara Taylor, Cicely Tyson, Terrell Carter, Carol Mitchell-Leon, Avery Knight, Vickie Eng, Tiffany Evans, Gary Anthony Sturgis, Bart Hansard, Chandra Currelley-Young",5.8,13413,5.5,50.652203,209.0,56.0,45.152203,820.9491454545455,2,2005
