title,date_published,genre,duration,director,writer,actors,avg_vote,votes,budget,worlwide_gross_income,reviews_from_users,reviews_from_critics,profit,roi,release_month,release_year
The Hollars,2016-08-26,"Comedy, Drama, Romance",88,John Krasinski,Jim Strouse,"Margo Martindale, Sharlto Copley, Richard Jenkins, John Krasinski, Anna Kendrick, Randall Park, Ashley Dyke, Isabela Costine, Didi Costine, Josh Groban, Charlie Day, Mary Kay Place, Timothy Crowe, Lacey Levy, Debbie Prescott",6.5,11175,3.8,1.138609,49.0,75.0,-2.661391,-70.0366052631579,8,2016
Boogeyman 2 - Il ritorno dell'uomo nero,2008-01-08,"Drama, Horror, Thriller",93,Jeff Betancourt,"Brian Sieve, Eric Kripke","Danielle Savre, Matt Cohen, Chrissy Calhoun, Michael Graziadei, Mae Whitman, Renée O'Connor, Tobin Bell, Johnny Simmons, David Gallagher, Lesli Margherita, Tom Lenk, Sammi Hanratty, Jarrod Bailey, Lucas Fleischer, Suzanne Jamieson",5.0,7685,4.5,1.798418,57.0,52.0,-2.701582,-60.035155555555555,1,2008
Havenhurst,2017-02-10,"Horror, Mystery, Thriller",85,Andrew C. Erin,"Andrew C. Erin, Daniel Farrands","Julie Benz, Belle Shouse, Josh Stamberg, Danielle Harris, Douglas Tait, Matt Lasky, Dendrie Taylor, Toby Huss, Jennifer Blanc-Biehn, Fionnula Flanagan, Currie Graham, Carrie Armstrong, Gwen Holloway",4.8,3531,3.0,0.289299,49.0,47.0,-2.710701,-90.3567,2,2017
Christmas in the Clouds,2005-12-04,"Comedy, Family, Romance",96,Kate Montgomery,Kate Montgomery,"Timothy Vahle, Sam Vlahos, Mariana Tosca, M. Emmet Walsh, Graham Greene, Sheila Tousey, Rosalind Ayres, Rita Coolidge, Lois Red Elk, Jonathan Joss, Shirley Cheechoo, Karina Moeller, Kaesi Belen Soto, Georgina Lightning, Brian Wescott",6.4,698,3.0,0.279225,70.0,19.0,-2.720775,-90.6925,12,2005
The Chaperone - In gita per caso,2011-03-24,"Action, Comedy, Family",103,Stephen Herek,S.J. Roth,"Paul Levesque, Kevin Corrigan, José Zúñiga, Kevin Rankin, Enrico Colantoni, Ashley Taylor, Israel Broussard, Darren O'Hare, Lucy Webb, Jake Austin Walker, Cullen Chaffin, Taylor Faye Ruffin, Conner Ann Waterman, James DuMont, Nick Gomez",5.0,4927,3.0,0.279147,31.0,23.0,-2.720853,-90.6951,3,2011
Love's Abiding Joy,2010-01-01,"Drama, Family, Western",87,Michael Landon Jr.,"Michael Landon Jr., Douglas Lloyd McIntosh","Erin Cottrell, Dale Midkiff, Logan Bartholomew, Frank McRae, William Morgan Sheppard, Drew Tyler Bell, Brett Coker, Mae Whitman, John Laughlin, Kevin Gage, Brianna Brown, James Tupper, Stephen Bridgewater, Blake Gibbons, Madison Leisle",7.0,1657,3.0,0.252726,18.0,5.0,-2.747274,-91.5758,1,2010
Close Range,2015-12-11,"Action, Crime, Thriller",80,Isaac Florentine,"Chad Law, Shane Dax Taylor","Scott Adkins, Nick Chinlund, Caitlin Keats, Madison Lawlor, Ramezani Javad, Tony Perez, Jake La Botz, Anthony L. Fernandez, Randy Hall, Scott Evans, Jeremy Marinas, Ray Diaz, Julien Cesario, Matt Ramirez, Jimmy Chhiu",5.0,4442,3.0,0.248978,47.0,38.0,-2.751022,-91.70073333333333,12,2015
Haunt,2019-09-13,"Horror, Thriller",92,"Scott Beck, Bryan Woods","Scott Beck, Bryan Woods","Katie Stevens, Will Brittain, Lauryn Alisa McClain, Andrew Lewis Caldwell, Shazi Raja, Schuyler Helford, Phillip Johnson Richardson, Chaney Morrow, Justin Marxen, Terri Partyka, Justin Rose, Damian Maffei, Schuyler White, Samuel Hunt, Karra Rae Robinson",6.3,16775,5.0,2.233978,275.0,104.0,-2.766022,-55.320440000000005,9,2019
Tim and Eric's Billion Dollar Movie,2012-01-27,Comedy,93,"Tim Heidecker, Eric Wareheim","Tim Heidecker, Eric Wareheim","Bill A. Jones, Jeff Goldblum, Bob Odenkirk, Frank Slaten, Bob Ross, Ronnie Rodriguez, Nancy Stelle, Jean-Michel Richaud, Marilyn Porayko, Erica Durance, Tim Heidecker, Eric Wareheim, Robert Loggia, William Atherton, Michael Gross",5.4,9329,3.0,0.22358,80.0,83.0,-2.77642,-92.54733333333334,1,2012
Screwed - Due criminali da strapazzo,2000-05-12,"Comedy, Crime",81,"Scott Alexander, Larry Karaszewski","Scott Alexander, Larry Karaszewski","Norm MacDonald, Dave Chappelle, Elaine Stritch, Danny DeVito, Daniel Benzali, Sherman Hemsley, Sarah Silverman, Malcolm Stewart, Lochlyn Munro, Brent Chapman, Brian Jensen, Shawn Macdonald, Kelly Fiddick, Helena Yea, Lorenzo Campbell",5.8,8321,10.0,7.201701,76.0,30.0,-2.798299,-27.98299,5,2000
Amiche di sangue,2018-08-02,"Comedy, Crime, Drama",92,Cory Finley,Cory Finley,"Olivia Cooke, Anya Taylor-Joy, Anton Yelchin, Paul Sparks, Francie Swift, Kaili Vernoff, Svetlana Orlova, Alyssa Fishenden, Jackson Damon, James Haddad, Nolan Ball, Celeste Oliva",6.7,32554,6.0,3.187255,201.0,173.0,-2.812745,-46.879083333333334,8,2018
Valley of Bones,2017-09-01,"Crime, Thriller, Western",90,Dan Glaser,"Dan Glaser, Steven Molony","Autumn Reeser, Rhys Coiro, Steven Molony, Mason Mahay, Alexandra Billings, Bill Smitrovich, Mark Margolis, Muse Watson, Bill Dablow, Brandon Heitkamp, Van White, Maddisyn Carter, Michaila Hicks, Esteban Andres Cruz, Johnse Allende Jr.",4.2,472,3.0,0.168738,10.0,1.0,-2.831262,-94.3754,9,2017
Snake & Mongoose,2013-09-06,Sport,102,Wayne Holloway,"Wayne Holloway, Alan Paradise","Jesse Williams, Richard Blake, Ashley Hinshaw, Kim Shaw, Noah Wyle, Tim Blake Nelson, Fred Dryer, John Heard, Leonardo Nam, Ian Ziering, Maxwell Perry Cotton, Devin Brochu, Julie Mond, Ken Medlock, Susan Traylor",5.7,621,3.0,0.1522,15.0,13.0,-2.8478,-94.92666666666668,9,2013
Dark Country,2009-10-09,"Crime, Mystery, Thriller",88,Thomas Jane,Tab Murphy,"Thomas Jane, Lauren German, Ron Perlman, Chris Browning, Con Schell, Rene Mousseux",5.3,4406,4.0,1.146422,41.0,28.0,-2.853578,-71.33945,10,2009
Sydney White - Biancaneve al college,2007-09-21,"Comedy, Drama, Romance",108,Joe Nussbaum,Chad Gomez Creasey,"Amanda Bynes, Sara Paxton, Matt Long, Jack Carpenter, Jeremy Howard, Crystal Hunt, Adam Hendershott, Danny Strong, Samm Levine, Libby Mintz, John Schneider, Arnie Pantoja, Donté Bonner, Brian Patrick Clarke, Lauren Leech",6.2,45476,16.5,13.620075,57.0,71.0,-2.879925,-17.454090909090908,9,2007
The Bronze: Sono la numero 1,2016-03-18,"Comedy, Drama, Sport",100,Bryan Buckley,"Melissa Rauch, Winston Rauch","Melissa Rauch, Gary Cole, Thomas Middleditch, Sebastian Stan, Cecily Strong, Haley Lu Richardson, Dale Raoul, Craig Kilborn, Dominique Dawes, Olga Korbut, Dominique Moceanu, Barak Hardley, Michael Shamus Wiles, Christine Abrahamsen, Ellery Sprayberry",6.1,9660,3.5,0.615816,63.0,67.0,-2.884184,-82.40525714285715,3,2016
Solo per vendetta,2011-09-02,"Action, Crime, Drama",105,Roger Donaldson,"Todd Hickey, Robert Tannen","Nicolas Cage, January Jones, Guy Pearce, Harold Perrineau, Jennifer Carpenter, Irone Singleton, Wayne Pére, Xander Berkeley, Marcus Lyle Brown, Dikran Tulaine, Joe Chrest, Demetrius Bridges, Jason Davis, Brett Gentile, Renwick D. Scott II",6.2,44195,17.0,14.089528,118.0,128.0,-2.910472,-17.120423529411767,9,2011
S. Darko,2009-08-21,"Drama, Mystery, Sci-Fi",103,Chris Fisher,"Nate Atkins, Richard Kelly","Daveigh Chase, Briana Evigan, James Lafferty, Ed Westwick, Walter Platz, John Hawkes, Bret Roberts, Jackson Rathbone, Elizabeth Berkley, Barbara Tarbuck, Matthew Davis, Nathan Stevens, Ryan Templeman, Zulay Henao, JJ Neward",3.6,13092,4.0,1.079949,123.0,87.0,-2.920051,-73.00127499999999,8,2009
Fort McCoy,2014-08-15,"Drama, History, War",100,"Kate Connor, Michael Worth",Kate Connor,"Eric Stoltz, Kate Connor, Lyndsy Fonseca, Andy Hirsch, Camryn Manheim, Seymour Cassel, Brendan Fehr, Gara Lonning, Johnny Pacar, Matthew Lawrence, Mark Metcalf, Marty Backstrand, Margot Farley, Rene Heger, Mara Connor",5.9,357,3.0,0.078948,11.0,8.0,-2.921052,-97.3684,8,2014
Code Red,2014-02-13,"Action, Horror, Sci-Fi",91,Valeri Milev,"Valeri Milev, Matthew Waynee","Paul Logan, Manal El-Feitury, Mya-Lecia Naylor, Julian Kostov, Georgi Staykov, Asen Mutafchiev, Ivelina Ivanova, Ralitsa Paskaleva, Ivan Kotsev, Nikolay Stanoev, Forbes KB, Ludmil Ilarionov, Dimo Alexiev, Kamen Ivanov, Valeri Yordanov",4.2,792,3.0,0.062431,14.0,7.0,-2.937569,-97.91896666666666,2,2014
Amnesiac,2015-11-12,"Drama, Horror, Mystery",90,Michael Polish,"Mike Le, Amy Kolquist","Kate Bosworth, Wes Bentley, Olivia Rose Keegan, Shashawnee Hall, Richard Riehle, Patrick Bauchau, Mia Barron, Adam Moryto",4.3,3458,3.0,0.061192,29.0,31.0,-2.938808,-97.96026666666666,11,2015
Screen Door Jesus,2003-03-12,"Comedy, Drama, Fantasy",119,Kirk Davis,"Christopher Cook, Kirk Davis","Myk Watford, Lafayette Wright, Silvia Mathis, Franchelle S. Dorn, Marc Menchaca, Bill Wise, Buck Taylor, Tommy G. Kendrick, C. Anthony Jackson, Josh Berry, Arron Shiver, Jo Harvey Allen, Cliff Stephens, Richard Dillard, Adam Bratcher",5.2,115,3.0,0.059,4.0,10.0,-2.941,-98.03333333333333,3,2003
Every Day,2017-02-09,"Comedy, Drama, Romance",93,Richard Levine,Richard Levine,"Liev Schreiber, Helen Hunt, Carla Gugino, Ezra Miller, Skyler Fortgang, David Harbour, Eddie Izzard, Brian Dennehy, Chris Beetem, Daniel Farcher, Matt Kempner, Daniel Yelsky, Sabrina Hahn, Tilky Jones, Michael H. Ingram",5.7,3279,3.0,0.046029,16.0,46.0,-2.953971,-98.4657,2,2017
The Joneses,2010-04-23,"Comedy, Drama",96,Derrick Borte,"Randy T. Dinzler, Derrick Borte","David Duchovny, Demi Moore, Amber Heard, Benjamin Hollingsworth, Gary Cole, Glenne Headly, Lauren Hutton, Chris Williams, Christine Evangelista, Robert Pralgo, Tiffany Morgan, Joe Narciso, Ric Reitz, L. Warren Young, Hayes Mercure",6.5,38056,10.0,7.043835,93.0,144.0,-2.956165,-29.56165,4,2010
Local Color,2009-08-15,Drama,107,George Gallo,George Gallo,"Armin Mueller-Stahl, Trevor Morgan, Ray Liotta, Charles Durning, Samantha Mathis, Ron Perlman, Diana Scarwid, Julie Lott, Tom Adams, Melissa Allman, Nancy Casemore, Sophia Kiapos, Michael Negrin, Taso Papadakis, David Sheftell",6.9,1454,3.0,0.032788,32.0,19.0,-2.967212,-98.90706666666667,8,2009
The Institute,2017-03-03,Thriller,98,"James Franco, Pamela Romanowsky","Matt Rager, Adam Rager","Allie Gallerani, James Franco, Joe Pease, Scott Haze, Lori Singer, Amber Viera, Val Lauren, Zoë Bleu Sidel, Gabrielle Haugh, Pamela Anderson, Cynthia Murell, Tim Blake Nelson, Topher Grace, Eric Roberts, Ben Youcef",4.1,2584,3.0,0.031634,41.0,16.0,-2.968366,-98.94553333333333,3,2017
Death in Love,2009-07-17,"Drama, Romance, War",97,Boaz Yakin,Boaz Yakin,"Josh Lucas, Jacqueline Bisset, Lukas Haas, Morena Baccarin, Betty Gilpin, Emma Bell, Vanessa Kai, Carrington Vilmont, Jean Brassard, Adam Brody, Stu Richel, Matt Walton, Jake Houston, Nicholas Sireci, Kelli Giddish",4.8,998,3.0,0.023412,11.0,14.0,-2.976588,-99.2196,7,2009
The People I've Slept With,2013-11-08,Comedy,89,Quentin Lee,Koji Steven Sakai,"Karin Anna Cheung, Wilson Cruz, Archie Kao, Lynn Chen, James Shigeta, Rane Jameson, Randall Park, Stacie Rippy, Danny Vasquez, Chris Zylka, Rylan Williams, Dana Lee, Elizabeth Sung, Cathy Shim, Perry Smith",4.8,671,3.0,0.019137,6.0,21.0,-2.980863,-99.3621,11,2013
Daltry Calhoun,2005-09-20,"Comedy, Drama, Music",100,Katrina Holden Bronson,Katrina Holden Bronson,"Elizabeth Banks, Johnny Knoxville, Beth Grant, Laura Cayouette, Thomas Jackson Burt, Ken Jackson, Sophie Traub, David Koechner, Matthew Sharp, James Parks, Kick Gurry, Juliette Lewis, Andrew Prine, Linda Wylie, Carri O'Neill",5.1,2242,3.0,0.012551,19.0,16.0,-2.987449,-99.58163333333333,9,2005
Furlough,2018-03-16,"Comedy, Drama",83,Laurie Collyer,Barry Strugatz,"Melissa Leo, Tessa Thompson, Edgar Ramírez, Erik Griffin, Drena De Niro, La La Anthony, Damien Lemon, Suzanne Shepherd, Michael Chernus, Dolly Wells, Anna Paquin, Whoopi Goldberg, Lorenzo Beronilla, Jerry Dean, Jennifer Delora",5.5,1382,3.0,0.008472,16.0,9.0,-2.991528,-99.71759999999999,3,2018
Janie Jones,2010-09-17,"Biography, Drama, Music",114,David M. Rosenthal,David M. Rosenthal,"Abigail Breslin, Alessandro Nivola, Elisabeth Shue, Brittany Snow, Peter Stormare, Joel David Moore, Frances Fisher, Frank Whaley, Rodney Eastman, David Lee Smith, Michael Panes, Robert Goodwin, Guy Van Swearingen, Adam Shalzi, Katie Rich",6.6,2152,3.0,0.00684,15.0,29.0,-2.99316,-99.772,9,2010
Tanner Hall - Storia di un'amicizia,2015-01-15,"Drama, Romance",96,"Francesca Gregorini, Tatiana von Fürstenberg","Tatiana von Fürstenberg, Francesca Gregorini","Rooney Mara, Georgia King, Brie Larson, Amy Ferguson, Tom Everett Scott, Amy Sedaris, Chris Kattan, Shawn Pyfrom, Ryan Schira, Susan Misner, Tara Subkoff, Annika Peterson, Alaina Lauren Steinberg, Konstantine Kakanias, Lowry Marshall",5.8,3299,3.0,0.005073,15.0,21.0,-2.994927,-99.8309,1,2015
L'incubo di Joanna Mills,2008-01-18,"Horror, Mystery, Thriller",85,Asif Kapadia,Adam Sussman,"Sarah Michelle Gellar, Peter O'Brien, Adam Scott, Kate Beahan, Sam Shepard, J.C. MacKenzie, Erinn Allison, Darrian McClanahan, Wally Welch, Frank Ertl, Brad Leland, Bonnie Gallup, Brent Smiga, Robert Wilson",4.7,11379,15.0,11.994195,126.0,103.0,-3.005805,-20.038700000000002,1,2008
Death Sentence,2007-08-31,"Action, Crime, Drama",105,James Wan,"Ian Mackenzie Jeffers, Brian Garfield","Kevin Bacon, Garrett Hedlund, Kelly Preston, Jordan Garrett, Stuart Lafferty, Aisha Tyler, John Goodman, Matt O'Leary, Edi Gathegi, Hector Atreyu Ruiz, Kanin Howell, Dennis Keiffer, Freddy Bouciegues, Leigh Whannell, Casey Pieretti",6.8,68198,20.0,16.974459,343.0,176.0,-3.025541,-15.127704999999999,8,2007
Cocaine - La vera storia di White Boy Rick,2019-03-07,"Crime, Drama",111,Yann Demange,"Andy Weiss, Logan Miller","Matthew McConaughey, Richie Merritt, Bel Powley, Jennifer Jason Leigh, Brian Tyree Henry, Rory Cochrane, RJ Cyler, Jonathan Majors, Eddie Marsan, Taylour Paige, Bruce Dern, Piper Laurie, Raekwon Haynes, Ishmael Ali, James Howard",6.4,24478,29.0,25.957482,192.0,125.0,-3.042518,-10.491441379310345,3,2019
Mi sono perso il Natale,2007-01-05,"Adventure, Comedy, Family",90,Paul Feig,"Jacob Meszaros, Mya Stark","Lewis Black, Wilmer Valderrama, Tyler James Williams, Dyllan Christopher, Brett Kelly, Gia Mantegna, Quinn Shephard, Paget Brewster, Rob Corddry, Dominique Saldaña, Jessica Walter, Rob Riggle, Michelle Sandler, David Koechner, B.J. Novak",5.3,10227,25.0,21.949234,64.0,78.0,-3.050766,-12.203064,1,2007
L'ultimo sogno,2002-01-11,Drama,125,Irwin Winkler,Mark Andrus,"Kevin Kline, Kristin Scott Thomas, Hayden Christensen, Jena Malone, Mary Steenburgen, Mike Weinberg, Scotty Leavenworth, Ian Somerhalder, Jamey Sheridan, Scott Bakula, Sandra Nelson, Sam Robards, John Pankow, Kim Delgado, Barry Primus",7.5,42526,27.0,23.903791,359.0,99.0,-3.096209,-11.46744074074074,1,2002
Seven Days in Utopia,2011-09-02,"Drama, Sport",100,Matthew Dean Russell,"David L. Cook, Rob Levine","Robert Duvall, Lucas Black, Melissa Leo, Deborah Ann Woll, Brian Geraghty, Kathy Baker, Joseph Lyle Taylor, Jerry Ferrara, K.J. Choi, Robert Bear, Josh Painting, Brandel Chamblee, Kelly Tilghman, Ezra Proch, Dora Madison",6.0,3085,7.5,4.373074,58.0,50.0,-3.126926,-41.692346666666666,9,2011
Only the Brave,2006-02-17,"Drama, War",99,Lane Nishikawa,Lane Nishikawa,"Tamlyn Tomita, Lane Nishikawa, Greg Watanabe, Mark Dacascos, Kipp Shiotani, Jason Scott Lee, Yuji Okumoto, Ehécatl Chávez, Sara Shields, Casey Koiwai, Jordan Nakahara, Ken Narasaki, Kenneth Choi, Gina Hiraizumi, Michael Sun Lee",5.3,773,3.3,0.15,22.0,6.0,-3.15,-95.45454545454545,2,2006
Dog Days,2018-09-13,"Comedy, Drama, Romance",113,Ken Marino,"Elissa Matsueda, Erica Oyama","Nina Dobrev, Vanessa Hudgens, Adam Pally, Eva Longoria, Rob Corddry, Tone Bell, Jon Bass, Michael Cassidy, Finn Wolfhard, Ron Cephas Jones, Thomas Lennon, Tig Notaro, Lauren Lapkus, Jessica St. Clair, Ryan Hansen",6.2,3926,10.0,6.842356,56.0,49.0,-3.157644,-31.57644,9,2018
13 peccati,2014-04-11,"Horror, Thriller",93,Daniel Stamm,"David Birke, Daniel Stamm","Mark Webber, Devon Graye, Tom Bower, Rutina Wesley, Ron Perlman, Pruitt Taylor Vince, Clyde Risley Jones, Deneen Tyler, Tom Lawson Jr., Sharon Smith, Greg Pearson, Ritchie Montgomery, Brylee Kate Woodard, Sabrina Gennarino, Hugh Ettinger",6.3,32536,4.0,0.826913,121.0,107.0,-3.173087,-79.32717500000001,4,2014
Scatto mortale - Paparazzi,2005-07-01,"Action, Crime, Drama",84,Paul Abascal,Forry Smith,"Cole Hauser, Robin Tunney, Dennis Farina, Daniel Baldwin, Tom Hollander, Kevin Gage, Blake Michael Bryan, Tom Sizemore, Andrea Baker, Jordan Baker, Joe Basile, Lauren Birkell, Wendy Braun, Kelly Carlson, Greg Castro",5.8,14473,20.0,16.796512,140.0,74.0,-3.203488,-16.01744,7,2005
The Last Five Years,2015-02-12,"Comedy, Drama, Musical",94,Richard LaGravenese,"Jason Robert Brown, Richard LaGravenese","Anna Kendrick, Jeremy Jordan, Tamara Mintz, Cassandra Inman, Kate Meltzer, Emma Meltzer, Bettina Bresnan, Charly Bivona, Alex Stebbins, Lily LaGravenese, Betina Joly, Upa Inspace, Lisa Herring, Nina Ordman, Robert Immerman",5.9,9305,3.5,0.292092,51.0,82.0,-3.207908,-91.65451428571428,2,2015
Midnight Son,2011-01-01,Horror,88,Scott Leberecht,Scott Leberecht,"Zak Kilberg, Maya Parish, Jo D. Jonz, Larry Cedar, Arlen Escarpeta, Tracey Walter, Kevin McCorkle, Juanita Jennings, Jeff Campbell, Junius Dion Jr., Stephen Geoffreys, Bonnie Jean, Billy Louviere, Jake McCorkle, Roddy McDowall",5.9,1695,3.25,0.000973,27.0,84.0,-3.249027,-99.97006153846154,1,2011
The Opposite Sex,2015-05-21,Comedy,97,"Jennifer Finnigan, Jonathan Silverman","Mark Mussina, Steven Sessions","Geoff Stults, Mena Suvari, Jennifer Finnigan, Josh Hopkins, Eric Roberts, Kenan Thompson, Josh Cooke, Debra Jo Rupp, Joey Fatone, Tom DeNucci, Jonathan Silverman, Kristin Chenoweth, Dana Ashbrook, Madeline Merritt, Danielle Guldin",4.5,938,3.3,0.050206,3.0,3.0,-3.249794,-98.47860606060605,5,2015
Quel che sapeva Maisie,2014-06-26,Drama,99,"Scott McGehee, David Siegel","Nancy Doyne, Carroll Cartwright","Julianne Moore, Steve Coogan, Alexander Skarsgård, Joanna Vanderham, Onata Aprile, Sadie Rae, Jesse Stone Spadaccini, Diana García, Amelia Campbell, Maddie Corman, Paddy Croft, Trevor Long, Emma Holzer, Nadia Gan, Samantha Buck",7.4,26484,6.0,2.711379,99.0,174.0,-3.288621,-54.81035,6,2014
La dea del successo,2000-04-20,Comedy,97,Albert Brooks,"Albert Brooks, Monica Mcgowan Johnson","Albert Brooks, Sharon Stone, Andie MacDowell, Jeff Bridges, Cybill Shepherd, Monica Mikala, Jamie Alexis, Marnie Shelton, Catherine MacNeal, Mark Feuerstein, Lorenzo Lamas, Jennifer Tilly, Bradley Whitford, Skip O'Brien, Aude Charles",5.7,10325,15.0,11.670561,145.0,102.0,-3.329439,-22.196260000000002,4,2000
Hostiles: Ostili,2018-03-22,"Drama, Western",134,Scott Cooper,"Scott Cooper, Donald E. Stewart","Scott Shepherd, Rosamund Pike, Ava Cooper, Stella Cooper, David Midthunder, Gray Wolf Herrera, Christian Bale, Rory Cochrane, Jonathan Majors, John Benjamin Hickey, Stafford Douglas, Stephen Lang, Bill Camp, Wes Studi, Jesse Plemons",7.2,67184,39.0,35.669017,439.0,189.0,-3.330983,-8.540982051282052,3,2018
Witless Protection,2008-02-22,"Comedy, Crime",99,Charles Robert Carner,"Charles Robert Carner, Charles Robert Carner","Larry the Cable Guy, Richard Bull, J. David Moeller, Will Clinger, Omar Dykes, Reno Collier, Jenny McCarthy, Yaphet Kotto, Ivana Milicevic, Dan Waller, Rick LeFevour, Joseph Luis Caballero, Sean Bridgers, Gerry Bednob, Claudia Michelle Wallace",3.3,5980,7.5,4.161625,24.0,36.0,-3.338375,-44.51166666666666,2,2008
Another Happy Day,2011-12-08,"Comedy, Drama",119,Sam Levinson,Sam Levinson,"Ellen Barkin, Ezra Miller, Ellen Burstyn, Demi Moore, Thomas Haden Church, Kate Bosworth, George Kennedy, Jeffrey DeMunn, Daniel Yelsky, Siobhan Fallon Hogan, Diana Scarwid, Eamon O'Rourke, Lola Kirke, David Hirsch, Michael Nardelli",6.1,3952,4.0,0.659937,48.0,45.0,-3.340063,-83.50157499999999,12,2011
L'ultima occasione,2006-11-05,"Comedy, Drama, Thriller",96,Michael Caleo,Michael Caleo,"Michael Keaton, Brendan Fraser, Amber Valletta, Daniel Stern, Richard Kuhlman, Alexis Cruz, Neal McDonough, William Ragsdale, Mike Hagerty, Maree Cheatham, David Jensen, Michael Lerner, Caroline McKinley, Sam Nazarian, Douglas M. Griffin",6.1,3466,4.0,0.655968,36.0,19.0,-3.344032,-83.60079999999999,11,2006
Swing Vote - Un uomo da 300 milioni di voti,2008-08-01,"Comedy, Drama",120,Joshua Michael Stern,"Jason Richman, Joshua Michael Stern","Kevin Costner, Madeline Carroll, Paula Patton, Kelsey Grammer, Dennis Hopper, Nathan Lane, Stanley Tucci, George Lopez, Judge Reinhold, Charles Esten, Richard Petty, Willie Nelson, Mare Winningham, Mark Moses, Nana Visitor",6.1,17457,21.0,17.635397,84.0,131.0,-3.364603,-16.02191904761905,8,2008
Winter Passing,2006-06-15,"Comedy, Drama",98,Adam Rapp,Adam Rapp,"Zooey Deschanel, Darrell Larson, John Bedford Lloyd, Deirdre O'Connell, Mandy Siegfried, Amy Madigan, Dallas Roberts, Ivan Martin, Robert Beitzel, Laurie Kennedy, Will Ferrell, Ed Harris, Mary Jo Deschanel, Amelia Warner, Sam Bottoms",6.3,8071,3.5,0.113783,58.0,53.0,-3.386217,-96.74905714285714,6,2006
Landshark: rischio a Wall Street,2009-10-08,Drama,88,Austin Chick,Howard A. Rodman,"Josh Hartnett, Naomie Harris, Adam Scott, Robin Tunney, Andre Royo, Emmanuelle Chriqui, Laila Robins, Caroline Lagerfelt, Alan Cox, David Bowie, Rip Torn, Jeremy Bobb, Jason Calacanis, Joie Chen, Athena Currey",5.3,4012,3.4,0.012636,35.0,38.0,-3.387364,-99.62835294117647,10,2009
Ogni cosa è illuminata,2005-11-11,"Comedy, Drama",106,Liev Schreiber,"Jonathan Safran Foer, Liev Schreiber","Eugene Hutz, Elijah Wood, Jonathan Safran Foer, Jana Hrabetova, Stephen Samudovsky, Ljubomir Dezera, Oleksandr Choroshko, Gil Kazimirov, Zuzana Hodkova, Mikki, Mouse, Boris Lyoskin, Robert Chytil, Jaroslava Sochova, Sergei Ryabtsev",7.4,56278,7.0,3.601974,184.0,98.0,-3.398026,-48.54322857142857,11,2005
D.E.B.S. - Spie in minigonna,2005-03-25,"Action, Comedy, Romance",91,Angela Robinson,Angela Robinson,"Sara Foster, Jordana Brewster, Meagan Good, Devon Aoki, Jill Ritchie, Geoff Stults, Jimmi Simpson, Jessica Cauffiel, Christina Kirk, Holland Taylor, Michael Clarke Duncan, J.B. Ghuman Jr., Scoot McNairy, Jean St. James, Eric Dearborn",5.3,14608,3.5,0.097446,162.0,52.0,-3.402554,-97.21582857142857,3,2005
Funny People,2009-10-16,"Comedy, Drama",146,Judd Apatow,Judd Apatow,"Adam Sandler, Seth Rogen, Leslie Mann, Eric Bana, Jonah Hill, Jason Schwartzman, Aubrey Plaza, Maude Apatow, Iris Apatow, RZA, Aziz Ansari, Torsten Voges, Allan Wasserman, Rod Man, Wayne Federman",6.3,113065,75.0,71.585235,335.0,237.0,-3.414765,-4.55302,10,2009
Destroyer,2019-06-06,"Action, Crime, Drama",121,Karyn Kusama,"Phil Hay, Matt Manfredi","Nicole Kidman, Toby Kebbell, Tatiana Maslany, Sebastian Stan, Scoot McNairy, Bradley Whitford, Toby Huss, James Jordan, Beau Knapp, Jade Pettyjohn, Shamier Anderson, Zach Villa, Natalia Cordova-Buckley, Colby French, Kelvin Han Yee",6.2,23655,9.0,5.58094,321.0,220.0,-3.41906,-37.989555555555555,6,2019
Poolhall Junkies,2003-02-28,"Comedy, Drama, Sport",99,Mars Callahan,"Mars Callahan, Chris Corso","Chazz Palminteri, Ricky Schroder, Rod Steiger, Michael Rosenbaum, Mars Callahan, Alison Eastwood, Phillip Glasser, Anson Mount, Glenn Plummer, Richard Portnow, Ernie Reyes Jr., Peter Mark Richman, Christopher Walken, Mike Massey, Orien Richman",6.9,9536,4.0,0.563711,116.0,35.0,-3.436289,-85.907225,2,2003
Una famiglia all'improvviso,2012-08-03,"Comedy, Drama",114,Alex Kurtzman,"Alex Kurtzman, Roberto Orci","Chris Pine, Elizabeth Banks, Michael Hall D'Addario, Michelle Pfeiffer, Olivia Wilde, Mark Duplass, Sara Mornell, Philip Baker Hall, Dean Chekvala, Barbara Eve Harris, David Burrus, Joseph Wise, Devin Brochu, Gabriela Milla, Abhi Sinha",7.1,41031,16.0,12.558931,92.0,109.0,-3.441069,-21.50668125,8,2012
Batman: Return of the Caped Crusaders,2016-10-11,"Animation, Action, Adventure",78,Rick Morales,"Michael Jelenic, James Tucker","Adam West, Burt Ward, Julie Newmar, Jeff Bergman, Sirena Irwin, Thomas Lennon, William Salyers, Lynne Marie Stewart, Jim Ward, Steven Weber, Wally Wingert",6.8,4566,3.5,0.056711,46.0,50.0,-3.443289,-98.37968571428571,10,2016
Nobel son - Un colpo da Nobel,2008-12-05,"Comedy, Crime, Drama",110,Randall Miller,"Jody Savin, Randall Miller","Alan Rickman, Bryan Greenberg, Shawn Hatosy, Mary Steenburgen, Bill Pullman, Eliza Dushku, Danny DeVito, Lindy Booth, Tracey Walter, Ted Danson, Ernie Hudson, Hal B. Klein, Matt Winston, Kirk Baily, Joyce Guy",6.3,5550,4.0,0.550782,43.0,58.0,-3.449218,-86.23045,12,2008
Battle of the Year - La vittoria è in ballo,2013-12-05,"Drama, Music",110,Benson Lee,"Brin Hill, Chris Parker","Josh Holloway, Laz Alonso, Josh Peck, Caity Lotz, Chris Brown, Ivan 'Flipz' Velez, Jon 'Do Knock' Cruz, Anis Cheurfa, Jesse 'Casper' Brown, David Shreibman, Sawandi Wilson, Richard Maguire, Steve Terada, Luis Rosado, Joshua Lee Ayers",5.0,8983,20.0,16.549477,30.0,64.0,-3.450523,-17.252615,12,2013
Infestation,2009-11-28,"Action, Adventure, Comedy",91,Kyle Rankin,Kyle Rankin,"Chris Marquette, Brooke Nevin, Kinsey Packard, E. Quincy Sloan, Wesley Thompson, Linda Park, Deborah Geffner, Jim Cody Williams, Bru Muller, Ismael 'East' Carlo, Diane Gaeta, Ray Wise, Atanas Srebrev, Vlado Mihailov, Mike Straub",5.9,8786,3.5,0.036756,52.0,68.0,-3.463244,-98.94982857142857,11,2009
The Hunt,2020-03-24,"Action, Horror, Thriller",90,Craig Zobel,"Nick Cuse, Damon Lindelof","Betty Gilpin, Hilary Swank, Ike Barinholtz, Wayne Duvall, Ethan Suplee, Emma Roberts, Christopher Berry, Sturgill Simpson, Kate Nowlin, Amy Madigan, Reed Birney, Glenn Howerton, Steve Coulter, Dean J. West, Vince Pisani",6.5,52794,14.0,10.530977,757.0,236.0,-3.469023,-24.778735714285716,3,2020
The Echo,2009-05-28,"Drama, Horror, Mystery",90,Yam Laranas,"Eric Bernt, Shintaro Shimosawa","Jesse Bradford, Amelia Warner, Carlos Leon, Iza Calzado, Kevin Durand, Louise Linton, Jamie Bloch, Pruitt Taylor Vince, Aron Tager, Hrant Alianak, Jayne Eastwood, Arnold Pinnock, Marvin Hinz, George Santino, Paulette Sinclair",5.6,5411,5.0,1.508127,37.0,43.0,-3.491873,-69.83746,5,2009
